,text,emotion,target_utterance,context_utterances,full_text,text_cleaned
656,kya hoga? yeh akhbaar pade ho kya?Monisha ye akhbaaro ka dher is beautiful couch pe kabse pada hai? mmmmm... yead nhi kafi dino se ish area mein aai nhi hu na. oh I understand. Anyway is ilaka Mein To Tumhara Aana Jana Hoga Na,2,oh I understand. Anyway is ilaka Mein To Tumhara Aana Jana Hoga Na,kya hoga? yeh akhbaar pade ho kya?Monisha ye akhbaaro ka dher is beautiful couch pe kabse pada hai? mmmmm... yead nhi kafi dino se ish area mein aai nhi hu na.,kya hoga? yeh akhbaar pade ho kya?Monisha ye akhbaaro ka dher is beautiful couch pe kabse pada hai? mmmmm... yead nhi kafi dino se ish area mein aai nhi hu na. oh I understand. Anyway is ilaka Mein To Tumhara Aana Jana Hoga Na,kya huga yeh akhbar pade hu kya munisha ye akhbaru ka dher beauti cuch pe kabs pada hai yead nhi kafi dinu se ish area mein ai nhi hu na uh understand anyvay ilaka mein tu tumhara aana jana huga na
657,arey monisha oh my god ye kya hai? paalak wo sabzi waala na bohot sasti de raha tha ek rupay ka ek bundle isliye meine saari paalak khareed li hua na fayda fayda monisha baapre ye paalak toh kharab ho jayegi kal tak kaun khayega itni saari paalak arey mummy ji mei puri building bech aaungi 5 rupay ka ek bundle hua ki nahi fayda jija ji now you see dushyant hmmm kya? that love is blind hein? and deaf huh and dumb,1,and dumb,arey monisha oh my god ye kya hai? paalak wo sabzi waala na bohot sasti de raha tha ek rupay ka ek bundle isliye meine saari paalak khareed li hua na fayda fayda monisha baapre ye paalak toh kharab ho jayegi kal tak kaun khayega itni saari paalak arey mummy ji mei puri building bech aaungi 5 rupay ka ek bundle hua ki nahi fayda jija ji now you see dushyant hmmm kya? that love is blind hein? and deaf huh,arey monisha oh my god ye kya hai? paalak wo sabzi waala na bohot sasti de raha tha ek rupay ka ek bundle isliye meine saari paalak khareed li hua na fayda fayda monisha baapre ye paalak toh kharab ho jayegi kal tak kaun khayega itni saari paalak arey mummy ji mei puri building bech aaungi 5 rupay ka ek bundle hua ki nahi fayda jija ji now you see dushyant hmmm kya? that love is blind hein? and deaf huh and dumb,arey munisha uh gud ye kya hai palak vu sabji vala na buhut sasti de raha tha ek rupay ka ek bundl isliy mein sari palak khare li hua na fayda fayda munisha bapr ye palak tuh kharab hu jayegi kal tak kaun khayega itni sari palak arey mumi ji mei puri build bech aungi 5 rupay ka ek bundl hua ki nahi fayda jija ji nuv yu se dushyant hm kya luve blind hein deaf huh dumb
658,Maiya yah Tumne bahut bura Kiya bahut bura Kiya Maine Maine Kya Kiya aaahaaahaaa... yah mythological film ki veham ki tarah Bholi mat Bano. maine Maine Kya Kiya Ek to Monisha ko speech Dene Se roka aur wo tarkif Kam Nahin aaye to uski speech Chura Liya Tumne cchi. chi chi,0,aaahaaahaaa... yah mythological film ki veham ki tarah Bholi mat Bano. maine Maine Kya Kiya Ek to Monisha ko speech Dene Se roka aur wo tarkif Kam Nahin aaye to uski speech Chura Liya Tumne cchi. chi chi,Maiya yah Tumne bahut bura Kiya bahut bura Kiya Maine Maine Kya Kiya,Maiya yah Tumne bahut bura Kiya bahut bura Kiya Maine Maine Kya Kiya aaahaaahaaa... yah mythological film ki veham ki tarah Bholi mat Bano. maine Maine Kya Kiya Ek to Monisha ko speech Dene Se roka aur wo tarkif Kam Nahin aaye to uski speech Chura Liya Tumne cchi. chi chi,maiya yah tumn bahut bura kiya bahut bura kiya main main kya kiya ahaha yah mythulug film ki veham ki tarah bhuli mat banu main main kya kiya ek tu munisha ku spech dene se ruka aur vu tarkif kam nahin aye tu uski spech chura liya tumn chi chi chi
659,"sahil, wo to tumhare birthday ke liye banayi thi jo har saal ata hai. Magar karan verma to pehli baar aya tha ab wo baar baar aega kyun haan, use apne daddy me ek bhot acha friend jo mil gya hai",2,"haan, use apne daddy me ek bhot acha friend jo mil gya hai","sahil, wo to tumhare birthday ke liye banayi thi jo har saal ata hai. Magar karan verma to pehli baar aya tha ab wo baar baar aega kyun","sahil, wo to tumhare birthday ke liye banayi thi jo har saal ata hai. Magar karan verma to pehli baar aya tha ab wo baar baar aega kyun haan, use apne daddy me ek bhot acha friend jo mil gya hai",sahil vu tu tumhar birthday ke liy banayi thi ju har sal ata hai magar karan verma tu pehli bar aya tha ab vu bar bar aega kyun han use apn dadi ek bhut acha friend ju mil gya hai
660,"She's so funny! Hai na. bohot majaak karti hai! Mai to kehata hu, aisi hi sense of humour vaali general secretary, humari society ke liy chaahiye. Haan! Aur mujhe to bohot saare jokes bhi aate hai. Chup nahi rahegi ye, huh, chup nahi rahegi.",2,"Chup nahi rahegi ye, huh, chup nahi rahegi.","She's so funny! Hai na. bohot majaak karti hai! Mai to kehata hu, aisi hi sense of humour vaali general secretary, humari society ke liy chaahiye. Haan! Aur mujhe to bohot saare jokes bhi aate hai.","She's so funny! Hai na. bohot majaak karti hai! Mai to kehata hu, aisi hi sense of humour vaali general secretary, humari society ke liy chaahiye. Haan! Aur mujhe to bohot saare jokes bhi aate hai. Chup nahi rahegi ye, huh, chup nahi rahegi.",su funi hai na buhut majak karti hai mai tu kehata hu aisi hi sens uf humur vali gener secretari humari sucieti ke liy chahiy han aur mujh tu buhut sare juke bhi ate hai chup nahi rahegi ye huh chup nahi rahegi
661,"Itni raat ko koi tumhe station nahi le jaa sakta, haan. Ek kam karo, khud ki thodi der 'chuk-chuk' bolo aur so jaao, okay? Hein? Madhu bhai ki bhateeji... Hein!",2,Madhu bhai ki bhateeji... Hein!,"Itni raat ko koi tumhe station nahi le jaa sakta, haan. Ek kam karo, khud ki thodi der 'chuk-chuk' bolo aur so jaao, okay? Hein?","Itni raat ko koi tumhe station nahi le jaa sakta, haan. Ek kam karo, khud ki thodi der 'chuk-chuk' bolo aur so jaao, okay? Hein? Madhu bhai ki bhateeji... Hein!",itni rat ku kui tumh statiun nahi le ja sakta han ek kam karu khud ki thudi der chuk chuk bulu aur su jau ukay hein madhu bhai ki bhateji hein
662,Ok. Beech Raste Mein accident Hoga theek 4:30 minute bad Nahin Nahin To fir isse. Roko Na ya fir woh accident ko roku Jo Likha Hai vah nishchit hoga You mean accident nishchit hoga Ji Just 1 minute haan. Hi Monisha hi beta listen good news vahan megamall Mein midnight se Lagi Hai sent off 80% off. Sirf 1 ghante ke liye. Only for ladies. Zaroor zaroor. To Fir Indravardhan ki gadi le jao na. Chabi kahan hai?,1,Just 1 minute haan. Hi Monisha hi beta listen good news vahan megamall Mein midnight se Lagi Hai sent off 80% off. Sirf 1 ghante ke liye. Only for ladies. Zaroor zaroor. To Fir Indravardhan ki gadi le jao na. Chabi kahan hai?,Ok. Beech Raste Mein accident Hoga theek 4:30 minute bad Nahin Nahin To fir isse. Roko Na ya fir woh accident ko roku Jo Likha Hai vah nishchit hoga You mean accident nishchit hoga Ji,Ok. Beech Raste Mein accident Hoga theek 4:30 minute bad Nahin Nahin To fir isse. Roko Na ya fir woh accident ko roku Jo Likha Hai vah nishchit hoga You mean accident nishchit hoga Ji Just 1 minute haan. Hi Monisha hi beta listen good news vahan megamall Mein midnight se Lagi Hai sent off 80% off. Sirf 1 ghante ke liye. Only for ladies. Zaroor zaroor. To Fir Indravardhan ki gadi le jao na. Chabi kahan hai?,ok bech rast mein acid huga thek 4 30 minut bad nahin nahin tu fir ise ruku na ya fir vuh acid ku ruku ju likha hai vah nishchit huga yu mean acid nishchit huga ji 1 minut han hi munisha hi beta listen gud nev vahan megam mein midnight se lagi hai sent uf 80 uf sirf 1 ghant ke liy fur ladi zarur jarur tu fir indravardhan ki gadi le jau na chabi kahan hai
663,"Mummy ji, uss jamane mein bhi wine thi? Maari gaye ye. Monisha beta, wine koi DVD player, ya microwave, ya mobile phone nahi hai, ki uss jamane mein na ho.",2,"Monisha beta, wine koi DVD player, ya microwave, ya mobile phone nahi hai, ki uss jamane mein na ho.","Mummy ji, uss jamane mein bhi wine thi? Maari gaye ye.","Mummy ji, uss jamane mein bhi wine thi? Maari gaye ye. Monisha beta, wine koi DVD player, ya microwave, ya mobile phone nahi hai, ki uss jamane mein na ho.",mumi ji us jaman mein bhi vine thi mari gay ye munisha beta vine kui dvd player ya micruvav ya mubil phune nahi hai ki us jaman mein na hu
664,Are Mummy Ji bhaiya Ji Ne Iske 10 rupaye Liye aur extra Puri Nahin Dali Main Khud Hi jaati hun. Nahin Nahin Nahin Monisha please ek Puri ke liye o bhagegi vel wale ki pichhe.usko Roko. kya kar raha ho Tumhen Aisi mom aap ko pata hai Monisha midd mizaz Ki monmozi hai.,1,mom aap ko pata hai Monisha midd mizaz Ki monmozi hai.,Are Mummy Ji bhaiya Ji Ne Iske 10 rupaye Liye aur extra Puri Nahin Dali Main Khud Hi jaati hun. Nahin Nahin Nahin Monisha please ek Puri ke liye o bhagegi vel wale ki pichhe.usko Roko. kya kar raha ho Tumhen Aisi,Are Mummy Ji bhaiya Ji Ne Iske 10 rupaye Liye aur extra Puri Nahin Dali Main Khud Hi jaati hun. Nahin Nahin Nahin Monisha please ek Puri ke liye o bhagegi vel wale ki pichhe.usko Roko. kya kar raha ho Tumhen Aisi mom aap ko pata hai Monisha midd mizaz Ki monmozi hai.,mumi ji bhaiya ji ne isk 10 rupay liy aur extra puri nahin dali main khud hi jati hun nahin nahin nahin munisha pleas ek puri ke liy u bhagegi vel vale ki pich usku ruku kya kar raha hu tumhen aisi mum ap ku pata hai munisha mid mijaj ki munmuji hai
665,"Monisha beta ye gobi drawer mein kaise pahuchi? Mummyji, Sahil ke kuch papers table par the jo ud rahe thi. To Sahil ne kaha ki Monisha tum in pe kuch vajan rakh do…to. To Monisha ne gobi rakh di.",2,To Monisha ne gobi rakh di.,"Monisha beta ye gobi drawer mein kaise pahuchi? Mummyji, Sahil ke kuch papers table par the jo ud rahe thi. To Sahil ne kaha ki Monisha tum in pe kuch vajan rakh do…to.","Monisha beta ye gobi drawer mein kaise pahuchi? Mummyji, Sahil ke kuch papers table par the jo ud rahe thi. To Sahil ne kaha ki Monisha tum in pe kuch vajan rakh do…to. To Monisha ne gobi rakh di.",munisha beta ye gubi draver mein kais pahuchi mumyji sahil ke kuch paper tabl par ju ud rahe thi tu sahil ne kaha ki munisha tum pe kuch vajan rakh du tu tu munisha ne gubi rakh di
666,"he he Raat Akeli hai ,bujha to ya tubelight.akaar mere pass,sabjiyan Hata Do, jo bhi Chahe Kahiye ,jo bhi Chahe Kahiye madam aapane Monisha ko Kahin Dekha? kya Sahil Ek To Main Itni mehnat Karke Tumhen seduce karne ki koshish kar rahi hun Aur Tum yah scene Tumne kaun se serial mein dekha?",2,yah scene Tumne kaun se serial mein dekha?,"he he Raat Akeli hai ,bujha to ya tubelight.akaar mere pass,sabjiyan Hata Do, jo bhi Chahe Kahiye ,jo bhi Chahe Kahiye madam aapane Monisha ko Kahin Dekha? kya Sahil Ek To Main Itni mehnat Karke Tumhen seduce karne ki koshish kar rahi hun Aur Tum","he he Raat Akeli hai ,bujha to ya tubelight.akaar mere pass,sabjiyan Hata Do, jo bhi Chahe Kahiye ,jo bhi Chahe Kahiye madam aapane Monisha ko Kahin Dekha? kya Sahil Ek To Main Itni mehnat Karke Tumhen seduce karne ki koshish kar rahi hun Aur Tum yah scene Tumne kaun se serial mein dekha?",rat ake hai bujha tu ya tubelight akar mere pa sabjiyan hata du ju bhi chahe kahiy ju bhi chahe kahiy madam apan munisha ku kahin dekha kya sahil ek tu main itni mehnat kark tumhen seduc karn ki kushish kar rahi hun aur tum yah scene tumn kaun se serial mein dekha
667,Dushyant sidhe sidhe hearing inke kaan mei kyon laga nhi dete? ok If you insist.. Madhuban kal abhi aap na Dhire Dhire Awaaz Sunna ...aaa aaaaa Dushyant what dhire dhire Inki Aankhon Ki Roshni Nahin Chali gai Aankhen kholte Hain Dheere Dheere.......Aise....... Aise,0,Dushyant what dhire dhire Inki Aankhon Ki Roshni Nahin Chali gai Aankhen kholte Hain Dheere Dheere.......Aise....... Aise,Dushyant sidhe sidhe hearing inke kaan mei kyon laga nhi dete? ok If you insist.. Madhuban kal abhi aap na Dhire Dhire Awaaz Sunna ...aaa aaaaa,Dushyant sidhe sidhe hearing inke kaan mei kyon laga nhi dete? ok If you insist.. Madhuban kal abhi aap na Dhire Dhire Awaaz Sunna ...aaa aaaaa Dushyant what dhire dhire Inki Aankhon Ki Roshni Nahin Chali gai Aankhen kholte Hain Dheere Dheere.......Aise....... Aise,dushyant sidh sidh hear ink kan mei kyun laga nhi dete uk yu insist madhuban kal abhi ap na dhire dhire avaj suna dushyant vhat dhire dhire inki aankhun ki rushni nahin chali gai aankhen khult hain dhere dhere ais ais
668,"Hi Maya! Doodh peeya? Indu, doodh peeya tumne!? No honey, because milk and champagne don't mix!",2,"No honey, because milk and champagne don't mix!","Hi Maya! Doodh peeya? Indu, doodh peeya tumne!?","Hi Maya! Doodh peeya? Indu, doodh peeya tumne!? No honey, because milk and champagne don't mix!",hi maya dudh peya indu dudh peya tumn nu huney milk champagn dun mix
669,"Chuo na chuo na, mujhe chuo na! Dekh, vaise bhi ise koi chuta nahi hai, upar se request kiye jaa raha hai.",2,"Dekh, vaise bhi ise koi chuta nahi hai, upar se request kiye jaa raha hai.","Chuo na chuo na, mujhe chuo na!","Chuo na chuo na, mujhe chuo na! Dekh, vaise bhi ise koi chuta nahi hai, upar se request kiye jaa raha hai.",chu na chu na mujh chu na dekh vais bhi ise kui chuta nahi hai upar se rekuest kiy ja raha hai
670,do akhbaro me apne rosesh ki photo chapi hai. kitna inam rakha hai sarkar ne iske sir pe,2,kitna inam rakha hai sarkar ne iske sir pe,do akhbaro me apne rosesh ki photo chapi hai.,do akhbaro me apne rosesh ki photo chapi hai. kitna inam rakha hai sarkar ne iske sir pe,du akhbaru apn rusesh ki phutu chapi hai kitna inam rakha hai sarkar ne isk sir pe
671,"brilliant, brilliant. Us devar ko apne ghar pe kabhi mat bulana. kyun? nhi kha ma kha firse coma me chala jaega na is kamre ki halat dekh kar",2,nhi kha ma kha firse coma me chala jaega na is kamre ki halat dekh kar,"brilliant, brilliant. Us devar ko apne ghar pe kabhi mat bulana. kyun?","brilliant, brilliant. Us devar ko apne ghar pe kabhi mat bulana. kyun? nhi kha ma kha firse coma me chala jaega na is kamre ki halat dekh kar",briliant briliant us devar ku apn ghar pe kabhi mat bulana kyun nhi kha kha firs cuma chala jaega na kamr ki halat dekh kar
672,"haan, or mene sabse ye bhi kaha ki memsahab ne khud banai hai mithai. Sabne jam ke khai. Or memsahab aapko khas dhanyawad bhi kaha hai or monisha ki banai mithai kha kar... kuch boli nhi... bhais",2,kuch boli nhi... bhais,"haan, or mene sabse ye bhi kaha ki memsahab ne khud banai hai mithai. Sabne jam ke khai. Or memsahab aapko khas dhanyawad bhi kaha hai or monisha ki banai mithai kha kar...","haan, or mene sabse ye bhi kaha ki memsahab ne khud banai hai mithai. Sabne jam ke khai. Or memsahab aapko khas dhanyawad bhi kaha hai or monisha ki banai mithai kha kar... kuch boli nhi... bhais",han ur mene sabs ye bhi kaha ki memsahab ne khud banai hai mithai sabn jam ke khai memsahab apku kha dhanyavad bhi kaha hai ur munisha ki banai mithai kha kar kuch buli nhi bhai
673,"Okay, okay, everybody! Maine guests ko invite karne ke liye ek chota sa writeup likkha hai! Post kar ke aao! Pehale suniye to sahi! Momma... Hmm, sunaao. Indu Sarabhai agar papad hote, to hum likhte, pichle 55 saal se mashoor, kurkure, swaadisth, shenkne mein aasaan, lekin vo papad nahi hai, vo toh hai insaan, aaiyega unki 55th birthday ke party mein, dinner hoga italian, not puri pulaao aur du mistaan farshaan! Haha! Lovely! Ho gaya? How was it? it was... Mom, party mein aur kya karenge?",2,"it was... Mom, party mein aur kya karenge?","Okay, okay, everybody! Maine guests ko invite karne ke liye ek chota sa writeup likkha hai! Post kar ke aao! Pehale suniye to sahi! Momma... Hmm, sunaao. Indu Sarabhai agar papad hote, to hum likhte, pichle 55 saal se mashoor, kurkure, swaadisth, shenkne mein aasaan, lekin vo papad nahi hai, vo toh hai insaan, aaiyega unki 55th birthday ke party mein, dinner hoga italian, not puri pulaao aur du mistaan farshaan! Haha! Lovely! Ho gaya? How was it?","Okay, okay, everybody! Maine guests ko invite karne ke liye ek chota sa writeup likkha hai! Post kar ke aao! Pehale suniye to sahi! Momma... Hmm, sunaao. Indu Sarabhai agar papad hote, to hum likhte, pichle 55 saal se mashoor, kurkure, swaadisth, shenkne mein aasaan, lekin vo papad nahi hai, vo toh hai insaan, aaiyega unki 55th birthday ke party mein, dinner hoga italian, not puri pulaao aur du mistaan farshaan! Haha! Lovely! Ho gaya? How was it? it was... Mom, party mein aur kya karenge?",okay ukay everybudi main guest ku invit karn ke liy ek chuta sa vriteup likha hai pust kar ke au pehal suniy tu sahi muma hm sunau indu sarabhai agar papad hute tu hum likht pichl 5 sal se mashur kurkur svadisth shenkn mein asan lekin vu papad nahi hai vu tuh hai insan aiyega unki 5th birthday ke parti mein diner huga italian nut puri pulau aur du mistan farshan haha luve hu gaya huv va va mum parti mein aur kya kareng
674,"Hai, maine suna hai ki tumhe stress related koi major problem hua hai The technicalTimes of India arrived I don't know about you but Mujhe to bahut major problem hai yah Apna bag sath mein Lekar kyon aaya hai?",1,I don't know about you but Mujhe to bahut major problem hai yah Apna bag sath mein Lekar kyon aaya hai?,"Hai, maine suna hai ki tumhe stress related koi major problem hua hai The technicalTimes of India arrived","Hai, maine suna hai ki tumhe stress related koi major problem hua hai The technicalTimes of India arrived I don't know about you but Mujhe to bahut major problem hai yah Apna bag sath mein Lekar kyon aaya hai?",hai main suna hai ki tumh stre relat kui majur prublem hua hai technicaltim uf india ariv dun knuv abut yu mujh tu bahut majur prublem hai yah apna bag sath mein lekar kyun aya hai
675,"Indu! Naatak mat karo. Jaise ki tumhe pata nahi ki 24th feb ko kya hai! Of course mujhe pata hai... Lekin, ek baar tum kaho na... You know 24th February ke baare mein jab tum kehti ho na, to aur accha lagta hai...",2,"Of course mujhe pata hai... Lekin, ek baar tum kaho na... You know 24th February ke baare mein jab tum kehti ho na, to aur accha lagta hai...",Indu! Naatak mat karo. Jaise ki tumhe pata nahi ki 24th feb ko kya hai!,"Indu! Naatak mat karo. Jaise ki tumhe pata nahi ki 24th feb ko kya hai! Of course mujhe pata hai... Lekin, ek baar tum kaho na... You know 24th February ke baare mein jab tum kehti ho na, to aur accha lagta hai...",indu natak mat karu jais ki tumh pata nahi ki 24th feb ku kya hai curs mujh pata hai lekin ek bar tum kahu na yu knuv 24th februari ke bare mein jab tum kehti hu na tu aur acha lagta hai
676,"Oh don't worry sweetie, mai ye Malvika ke saath kar lungi. Malvika Grover? Hmm Vo tumhaare saath nare lagaayengee? Aray vo apne aap se baat karti hai to ""Kya kaha, kya kaha?"", itna dheere bolti hai. Vo cheekhegee kaise.",2,"Aray vo apne aap se baat karti hai to ""Kya kaha, kya kaha?"", itna dheere bolti hai. Vo cheekhegee kaise.","Oh don't worry sweetie, mai ye Malvika ke saath kar lungi. Malvika Grover? Hmm Vo tumhaare saath nare lagaayengee?","Oh don't worry sweetie, mai ye Malvika ke saath kar lungi. Malvika Grover? Hmm Vo tumhaare saath nare lagaayengee? Aray vo apne aap se baat karti hai to ""Kya kaha, kya kaha?"", itna dheere bolti hai. Vo cheekhegee kaise.",oh dun vuri sveti mai ye malvika ke sath kar lungi malvika gruver hm vu tumhar sath nare lagayeng aray vu apn ap se bat karti hai tu kya kaha kya kaha itna dhere bulti hai vu chekheg kais
677,"Sahil, tum tiger ho, ya tota? Mai toh samajhata tha ki mai insaan hu.",2,Mai toh samajhata tha ki mai insaan hu.,"Sahil, tum tiger ho, ya tota?","Sahil, tum tiger ho, ya tota? Mai toh samajhata tha ki mai insaan hu.",sahil tum tiger hu ya tuta mai tuh samajhata tha ki mai insan hu
678,"daddy ji, wo chatni mat khaiye, wo 3 hafte purani hai, ye lijiye ye tazi hai haan, pichle hafte hi layi thi.",2,"haan, pichle hafte hi layi thi.","daddy ji, wo chatni mat khaiye, wo 3 hafte purani hai, ye lijiye ye tazi hai","daddy ji, wo chatni mat khaiye, wo 3 hafte purani hai, ye lijiye ye tazi hai haan, pichle hafte hi layi thi.",dadi ji vu chatni mat khaiy vu 3 haft purani hai ye lijiy ye taji hai han pichl haft hi layi thi
679,Maiya Main To Pahle Se Hi kahati hun are roses Nalayak ladka hai chal Himmat mat Haro. abhi Kuchh Nahin bigrah Hum Ek kam karte hain roses Ko Kisi Mele Mein khoke Ke Aate Hain. Indra I'm serious meri baat suno agale mahine China per Ek electronics fair hai Ham usko vahan khoke aaenge aur passport faad Denge uski paise chhin Lenge FIR dekhte hain vah Chinese Hindi mein Kavita Kaise karta hai,2,meri baat suno agale mahine China per Ek electronics fair hai Ham usko vahan khoke aaenge aur passport faad Denge uski paise chhin Lenge FIR dekhte hain vah Chinese Hindi mein Kavita Kaise karta hai,Maiya Main To Pahle Se Hi kahati hun are roses Nalayak ladka hai chal Himmat mat Haro. abhi Kuchh Nahin bigrah Hum Ek kam karte hain roses Ko Kisi Mele Mein khoke Ke Aate Hain. Indra I'm serious,Maiya Main To Pahle Se Hi kahati hun are roses Nalayak ladka hai chal Himmat mat Haro. abhi Kuchh Nahin bigrah Hum Ek kam karte hain roses Ko Kisi Mele Mein khoke Ke Aate Hain. Indra I'm serious meri baat suno agale mahine China per Ek electronics fair hai Ham usko vahan khoke aaenge aur passport faad Denge uski paise chhin Lenge FIR dekhte hain vah Chinese Hindi mein Kavita Kaise karta hai,maiya main tu pahl se hi kahati hun ruse nalayak ladka hai chal himat mat haru abhi kuch nahin bigrah hum ek kam kart hain ruse ku kisi mele mein khuke ke aat hain indra seriu meri bat sunu agal mahin china per ek electrun fair hai ham usku vahan khuke aeng aur paspurt fad deng uski pais chin leng fir dekht hain vah chines hindi mein kavita kais karta hai
680,Compensation! acchi baat hai kya kimat Lagai Hai aapane Ek tang ki? Ham Nahin Nahin Bata dijiye aapane value to ki Hogi ki ek aadami ki tang itne kimat per bikti hai Humne Kabhi kharidi Nahin Right Humne To Kabhi murgi ki tang bhi nahin Karidi. Ham to vegetarian hai,1,Right Humne To Kabhi murgi ki tang bhi nahin Karidi. Ham to vegetarian hai,Compensation! acchi baat hai kya kimat Lagai Hai aapane Ek tang ki? Ham Nahin Nahin Bata dijiye aapane value to ki Hogi ki ek aadami ki tang itne kimat per bikti hai Humne Kabhi kharidi Nahin,Compensation! acchi baat hai kya kimat Lagai Hai aapane Ek tang ki? Ham Nahin Nahin Bata dijiye aapane value to ki Hogi ki ek aadami ki tang itne kimat per bikti hai Humne Kabhi kharidi Nahin Right Humne To Kabhi murgi ki tang bhi nahin Karidi. Ham to vegetarian hai,cumpensatiun achi bat hai kya kimat lagai hai apan ek tang ki ham nahin nahin bata dijiy apan valu tu ki hugi ki ek adami ki tang itn kimat per bikti hai humn kabhi kharidi nahin right humn tu kabhi murgi ki tang bhi nahin karidi ham tu vegetarian hai
681,mei kavi hun did you hear? kavi hai ! kavi nahi hai . tu Kauwa hai ee nahi aa aa ! Kauwa ! kaao kaao dophar bar kaao kaao kaao karke public ko bore kar raha tha ye,3,did you hear? kavi hai ! kavi nahi hai . tu Kauwa hai ee nahi aa aa ! Kauwa ! kaao kaao dophar bar kaao kaao kaao karke public ko bore kar raha tha ye,mei kavi hun,mei kavi hun did you hear? kavi hai ! kavi nahi hai . tu Kauwa hai ee nahi aa aa ! Kauwa ! kaao kaao dophar bar kaao kaao kaao karke public ko bore kar raha tha ye,mei kavi hun yu hear kavi hai kavi nahi hai tu kauva hai e nahi kauva kau kau duphar bar kau kau kau kark public ku bure kar raha tha ye
682, Huh. All the best Monisha.,2,Huh. All the best Monisha.,, Huh. All the best Monisha.,huh al best munisha
683,"Haan to, agar Baldev Rosesh se bhi buri kavita likhata hai to ye Sarupa bhi kuch kum nahi hai. Subaha subaha uth ke ""Baabul moraaa, Babulaaaa moraa"", nahi karti? Ise riyas kehete hai.",2,Ise riyas kehete hai.,"Haan to, agar Baldev Rosesh se bhi buri kavita likhata hai to ye Sarupa bhi kuch kum nahi hai. Subaha subaha uth ke ""Baabul moraaa, Babulaaaa moraa"", nahi karti?","Haan to, agar Baldev Rosesh se bhi buri kavita likhata hai to ye Sarupa bhi kuch kum nahi hai. Subaha subaha uth ke ""Baabul moraaa, Babulaaaa moraa"", nahi karti? Ise riyas kehete hai.",han tu agar baldev rusesh se bhi buri kavita likhata hai tu ye sarupa bhi kuch kum nahi hai subaha subaha uth ke babul mura babula mura nahi karti ise riya kehet hai
684,"Ye kya paagalpan hai, Monisha! Sahil, agar aaj meri jindaagi ka aakhri din hai, to to aaj ka har pal mein tumhaare kareeb rehana chaahati hu... Aur agar mujhe bathroom jaana hua to? To mai bhi chalungi tumhaare saath... Achchha, to theek hai, mai ek julab ki goli kha leta hu, fir chalna har 5-5 minute mein mere saath!",3,"Achchha, to theek hai, mai ek julab ki goli kha leta hu, fir chalna har 5-5 minute mein mere saath!","Ye kya paagalpan hai, Monisha! Sahil, agar aaj meri jindaagi ka aakhri din hai, to to aaj ka har pal mein tumhaare kareeb rehana chaahati hu... Aur agar mujhe bathroom jaana hua to? To mai bhi chalungi tumhaare saath...","Ye kya paagalpan hai, Monisha! Sahil, agar aaj meri jindaagi ka aakhri din hai, to to aaj ka har pal mein tumhaare kareeb rehana chaahati hu... Aur agar mujhe bathroom jaana hua to? To mai bhi chalungi tumhaare saath... Achchha, to theek hai, mai ek julab ki goli kha leta hu, fir chalna har 5-5 minute mein mere saath!",ye kya pagalpan hai munisha sahil agar aj meri jindagi ka akhri din hai tu tu aj ka har pal mein tumhar kareb rehana chahati hu aur agar mujh bathrum jana hua tu tu mai bhi chalungi tumhar sath achcha tu thek hai mai ek julab ki guli kha leta hu fir chalna har 5 5 minut mein mere sath
685,"Acha now cut it out huh Indravardhan. Rosesh sweety Tumhi nikalo na Sara kachra bahar Ok chaliye dad, mein aapko bahar fenk kar Aata hun!",2,"Ok chaliye dad, mein aapko bahar fenk kar Aata hun!",Acha now cut it out huh Indravardhan. Rosesh sweety Tumhi nikalo na Sara kachra bahar,"Acha now cut it out huh Indravardhan. Rosesh sweety Tumhi nikalo na Sara kachra bahar Ok chaliye dad, mein aapko bahar fenk kar Aata hun!",acha nuv cut ut huh indravardhan rusesh sveti tumhi nikalu na sara kachra bahar ok chaliy dad mein apku bahar fenk kar aata hun
