,text,emotion,target_utterance,context_utterances,full_text,text_cleaned
0,"Are aajkal to Chhoti Chhoti Baton per gussa karne Lag Gai Hai. parso mein sirf ek ghanta kam per late aya to mujhe dantne Lag Gai. ""vitthal ya Sarkari office hai? Vitthal Tum government servant ho?"". bhala aap hi sochiye Ek izzatdaar, Imaandaar aadami ko government servant Bulana acchi baat hai? Sahil baba aap bolte the Radha Bai Mera Ek shirt dholo. ""Us department mein jao"", aisa maine aapko Kabhi bola tha? aur jab aap apni girlfriend ko Chori chupi Ghar late the to Kamre ke bahar pehra Mein deta tha. kabhi main aapse chai Pani Manga?",2,aur jab aap apni girlfriend ko Chori chupi Ghar late the to Kamre ke bahar pehra Mein deta tha. kabhi main aapse chai Pani Manga?,"Are aajkal to Chhoti Chhoti Baton per gussa karne Lag Gai Hai. parso mein sirf ek ghanta kam per late aya to mujhe dantne Lag Gai. ""vitthal ya Sarkari office hai? Vitthal Tum government servant ho?"". bhala aap hi sochiye Ek izzatdaar, Imaandaar aadami ko government servant Bulana acchi baat hai? Sahil baba aap bolte the Radha Bai Mera Ek shirt dholo. ""Us department mein jao"", aisa maine aapko Kabhi bola tha?","Are aajkal to Chhoti Chhoti Baton per gussa karne Lag Gai Hai. parso mein sirf ek ghanta kam per late aya to mujhe dantne Lag Gai. ""vitthal ya Sarkari office hai? Vitthal Tum government servant ho?"". bhala aap hi sochiye Ek izzatdaar, Imaandaar aadami ko government servant Bulana acchi baat hai? Sahil baba aap bolte the Radha Bai Mera Ek shirt dholo. ""Us department mein jao"", aisa maine aapko Kabhi bola tha? aur jab aap apni girlfriend ko Chori chupi Ghar late the to Kamre ke bahar pehra Mein deta tha. kabhi main aapse chai Pani Manga?",ajkal tu chuti chuti batun per gusa karn lag gai hai parsu mein sirf ek ghanta kam per late aya tu mujh dantn lag gai vithal ya sarkari ufic hai vithal tum guvern servant hu bhala ap hi suchiy ek ijatdar imandar adami ku guvern servant bulana achi bat hai sahil baba ap bult radha bai mera ek shirt dhulu us depart mein jau aisa main apku kabhi bula tha aur jab ap apni girlfriend ku churi chupi ghar late tu kamr ke bahar pehra mein deta tha kabhi main aps chai pani manga
1,sard dard kyu hai? Bas tension ki wajah se! isne apni photographs director raj gopal sharma ki offfice mei di hai. uski aane waali film naya don ke liye toh fir iski photographs dekh kar tension unhe hona chaiye isse kyun? Thanks! dad ke replacement,2,Thanks! dad ke replacement,sard dard kyu hai? Bas tension ki wajah se! isne apni photographs director raj gopal sharma ki offfice mei di hai. uski aane waali film naya don ke liye toh fir iski photographs dekh kar tension unhe hona chaiye isse kyun?,sard dard kyu hai? Bas tension ki wajah se! isne apni photographs director raj gopal sharma ki offfice mei di hai. uski aane waali film naya don ke liye toh fir iski photographs dekh kar tension unhe hona chaiye isse kyun? Thanks! dad ke replacement,sard dard kyu hai ba tensiun ki vajah se isn apni phutugraph directur raj gupal sharma ki ufic mei di hai uski ane vali film naya dun ke liy tuh fir iski phutugraph dekh kar tensiun unh huna chaiy ise kyun thank dad ke replac
2,"Hass kya raha hai tu Rosesh! Aray teri kavita sunn kar to tera gala ghot kar maar daalne ka dil kiya tha mujhe! Meri kavita mein kya boora tha? I'll tell you... Tumhaari kavita mein ek to, 1st shabdh boora tha, baad mein 2nd shabdh bhi boora tha... 3rd, 4th, 5th haala ki itne boore nahi the... 6th, 7th, 8th, haan, correct, vo bhi boore the.... Lekin, lekin, Rosesh, 9th, 10th, 11th, bohot boore the!",2,"I'll tell you... Tumhaari kavita mein ek to, 1st shabdh boora tha, baad mein 2nd shabdh bhi boora tha... 3rd, 4th, 5th haala ki itne boore nahi the... 6th, 7th, 8th, haan, correct, vo bhi boore the.... Lekin, lekin, Rosesh, 9th, 10th, 11th, bohot boore the!",Hass kya raha hai tu Rosesh! Aray teri kavita sunn kar to tera gala ghot kar maar daalne ka dil kiya tha mujhe! Meri kavita mein kya boora tha?,"Hass kya raha hai tu Rosesh! Aray teri kavita sunn kar to tera gala ghot kar maar daalne ka dil kiya tha mujhe! Meri kavita mein kya boora tha? I'll tell you... Tumhaari kavita mein ek to, 1st shabdh boora tha, baad mein 2nd shabdh bhi boora tha... 3rd, 4th, 5th haala ki itne boore nahi the... 6th, 7th, 8th, haan, correct, vo bhi boore the.... Lekin, lekin, Rosesh, 9th, 10th, 11th, bohot boore the!",kya raha hai tu rusesh aray teri kavita sun kar tu tera gala ghut kar mar daln ka dil kiya tha mujh meri kavita mein kya bura tha l tel yu tumhari kavita mein ek tu 1st shabdh bura tha bad mein 2nd shabdh bhi bura tha 3rd 4th 5th hala ki itn bure nahi 6th 7th 8th han curect vu bhi bure lekin lekin rusesh 9th 10th 1th buhut bure
3,"Mera naam hai, Padmaavati. Pyar se log mujhe, Pappu kehate hai... Tumhaara naam kya hai? Eena, Meena, Anju,.... Meri chodo! Tum Pappu kyu ho!? Pappu! Padmaavati ka short from to Paddy hona chaahiye... Pappu is just so middle class!",2,Padmaavati ka short from to Paddy hona chaahiye... Pappu is just so middle class!,"Mera naam hai, Padmaavati. Pyar se log mujhe, Pappu kehate hai... Tumhaara naam kya hai? Eena, Meena, Anju,.... Meri chodo! Tum Pappu kyu ho!? Pappu!","Mera naam hai, Padmaavati. Pyar se log mujhe, Pappu kehate hai... Tumhaara naam kya hai? Eena, Meena, Anju,.... Meri chodo! Tum Pappu kyu ho!? Pappu! Padmaavati ka short from to Paddy hona chaahiye... Pappu is just so middle class!",mera nam hai padmavati pyar se lug mujh papu kehat hai tumhara nam kya hai eena mena anju meri chudu tum papu kyu hu papu padmavati ka shurt frum tu padi huna chahiy papu su midl cla
4,sahil bhai sahil bhai . sahil bhai momma ko kuch ho gaya hai ! bohot hi odd tarah se behave kar rahi hai aisa behave karte hue meine pehle kabhi nahi dekha hai yaani maya acha behave kar rahi hai tch strange!,2,yaani maya acha behave kar rahi hai tch strange!,sahil bhai sahil bhai . sahil bhai momma ko kuch ho gaya hai ! bohot hi odd tarah se behave kar rahi hai aisa behave karte hue meine pehle kabhi nahi dekha hai,sahil bhai sahil bhai . sahil bhai momma ko kuch ho gaya hai ! bohot hi odd tarah se behave kar rahi hai aisa behave karte hue meine pehle kabhi nahi dekha hai yaani maya acha behave kar rahi hai tch strange!,sahil bhai sahil bhai sahil bhai muma ku kuch hu gaya hai buhut hi ud tarah se behav kar rahi hai aisa behav kart hue mein pehl kabhi nahi dekha hai yani maya acha behav kar rahi hai tch strang
5,"Maine soocha ki bechaare baccho ki thodi bohot madat ho jayegi, hain na Daddyji. Waisa isme koi scheme teme chal raha hain kya? Scheme? Matlab ye bol raha hain ki wo scheme teme jahan wo koi filmstar ke saath dinner Ya phir saalbhar ke liya kuuch Cola aisa kuch Well wo hum aapko humaare society ka life patron bana deenge Matlab aap mujhe ek flat deengi free mein apne housing society mein?",1,Matlab aap mujhe ek flat deengi free mein apne housing society mein?,"Maine soocha ki bechaare baccho ki thodi bohot madat ho jayegi, hain na Daddyji. Waisa isme koi scheme teme chal raha hain kya? Scheme? Matlab ye bol raha hain ki wo scheme teme jahan wo koi filmstar ke saath dinner Ya phir saalbhar ke liya kuuch Cola aisa kuch Well wo hum aapko humaare society ka life patron bana deenge","Maine soocha ki bechaare baccho ki thodi bohot madat ho jayegi, hain na Daddyji. Waisa isme koi scheme teme chal raha hain kya? Scheme? Matlab ye bol raha hain ki wo scheme teme jahan wo koi filmstar ke saath dinner Ya phir saalbhar ke liya kuuch Cola aisa kuch Well wo hum aapko humaare society ka life patron bana deenge Matlab aap mujhe ek flat deengi free mein apne housing society mein?",main sucha ki bechar bachu ki thudi buhut madat hu jayegi hain na dadyji waisa ism kui scheme teme chal raha hain kya scheme matlab ye bul raha hain ki vu scheme teme jahan vu kui filmstar ke sath diner ya phir salbhar ke liya kuch cula aisa kuch wel vu hum apku humar sucieti ka life patrun bana deng matlab ap mujh ek flat dengi fre mein apn huse sucieti mein
6,"Champagne kholo! Come on! Open the bottle! Yes of course! Absolutely! Champagne! Yaani devil's drink! Oh part Ridicule, iske ek glass mein 326 calories hoti hai, samjha! Kutte ka role to gaya haat se, ab bhaise ka role bhi koi nahi dega.",2,"Oh part Ridicule, iske ek glass mein 326 calories hoti hai, samjha! Kutte ka role to gaya haat se, ab bhaise ka role bhi koi nahi dega.",Champagne kholo! Come on! Open the bottle! Yes of course! Absolutely! Champagne! Yaani devil's drink!,"Champagne kholo! Come on! Open the bottle! Yes of course! Absolutely! Champagne! Yaani devil's drink! Oh part Ridicule, iske ek glass mein 326 calories hoti hai, samjha! Kutte ka role to gaya haat se, ab bhaise ka role bhi koi nahi dega.",champagn khulu cume un open butl ye uf curs absulut champagn yani devil drink oh part ridicul isk ek gla mein 326 caluri huti hai samjha kute ka rule tu gaya hat se ab bhais ka rule bhi kui nahi dega
7,"No, I mean, Monisha door to door jaa ke, logonko jokes suna rahi hai! Votes jeetane ke chakkar mein. Bruce Lee ki gujarathi bahan ka naam kya, 'Rootli'. Uhh, can you believe it. Aur, surprising thing is, apani building vaale, has rahe the aise jokes pe. Momma, kisi ne sach hi kaha hai, laughter is the best medicine. Jab laughter classy ho tab. Middle class is just..., noise! 'Hahaha' kar ke hasate hai, Monisha ke C-grade jokes par.",2,"Middle class is just..., noise! 'Hahaha' kar ke hasate hai, Monisha ke C-grade jokes par.","No, I mean, Monisha door to door jaa ke, logonko jokes suna rahi hai! Votes jeetane ke chakkar mein. Bruce Lee ki gujarathi bahan ka naam kya, 'Rootli'. Uhh, can you believe it. Aur, surprising thing is, apani building vaale, has rahe the aise jokes pe. Momma, kisi ne sach hi kaha hai, laughter is the best medicine. Jab laughter classy ho tab.","No, I mean, Monisha door to door jaa ke, logonko jokes suna rahi hai! Votes jeetane ke chakkar mein. Bruce Lee ki gujarathi bahan ka naam kya, 'Rootli'. Uhh, can you believe it. Aur, surprising thing is, apani building vaale, has rahe the aise jokes pe. Momma, kisi ne sach hi kaha hai, laughter is the best medicine. Jab laughter classy ho tab. Middle class is just..., noise! 'Hahaha' kar ke hasate hai, Monisha ke C-grade jokes par.",nu mean munisha dur tu dur ja ke lugunku juke suna rahi hai vute jetan ke chakar mein bruce le ki gujarathi bahan ka nam kya rutli uh yu believ aur surpris thing apani build vale rahe ais juke pe muma kisi ne sach hi kaha hai laughter best medicin jab laughter clasi hu tab midl cla nuis hahaha kar ke hasat hai munisha ke c grade juke par
8,keep quiet both of you please sahil tum jaa kar ke wo belt le aao please ye monisha ki bacchi le ayegi na . dewar ki chamchi. come on get his belt monisha wahan bargain mat karna please,2,monisha wahan bargain mat karna please,keep quiet both of you please sahil tum jaa kar ke wo belt le aao please ye monisha ki bacchi le ayegi na . dewar ki chamchi. come on get his belt,keep quiet both of you please sahil tum jaa kar ke wo belt le aao please ye monisha ki bacchi le ayegi na . dewar ki chamchi. come on get his belt monisha wahan bargain mat karna please,kep kuiet buth uf yu pleas sahil tum ja kar ke vu belt le au pleas ye munisha ki bachi le ayegi na devar ki chamchi cume un get belt munisha vahan bargain mat karna pleas
9,"Indravardhan se jyaada immature aur irritating duniya mein koi nahi ho sakta! Sahil ye dekho gobi mil gayi! Drawer mein thi. I'm sorry, Monisha ho sakti hai. Kya? Monisha beta, ye gobi drawer mein kaise pahuchi?",0,"Monisha beta, ye gobi drawer mein kaise pahuchi?","Indravardhan se jyaada immature aur irritating duniya mein koi nahi ho sakta! Sahil ye dekho gobi mil gayi! Drawer mein thi. I'm sorry, Monisha ho sakti hai. Kya?","Indravardhan se jyaada immature aur irritating duniya mein koi nahi ho sakta! Sahil ye dekho gobi mil gayi! Drawer mein thi. I'm sorry, Monisha ho sakti hai. Kya? Monisha beta, ye gobi drawer mein kaise pahuchi?",indravardhan se jyada imatur aur irit duniya mein kui nahi hu sakta sahil ye dekhu gubi mil gayi draver mein thi suri munisha hu sakti hai kya munisha beta ye gubi draver mein kais pahuchi
10,"Ye lo. Pink roomaal? Shocking pink, actually. Ye chalega? Peacock blue!? Monisha beta, tumhaare paas koi aisa roomaal hai jise dekhakar lage ki ye shayad roomaal hai.",2,"Monisha beta, tumhaare paas koi aisa roomaal hai jise dekhakar lage ki ye shayad roomaal hai.","Ye lo. Pink roomaal? Shocking pink, actually. Ye chalega? Peacock blue!?","Ye lo. Pink roomaal? Shocking pink, actually. Ye chalega? Peacock blue!? Monisha beta, tumhaare paas koi aisa roomaal hai jise dekhakar lage ki ye shayad roomaal hai.",ye lu pink rumal shuck pink actuali ye chalega peacuck blue munisha beta tumhar pa kui aisa rumal hai jise dekhakar lage ki ye shayad rumal hai
11,"Radhabai chhutti pe gayi hai.. I mean, I mean, Maya suno, ghar ka washing machine bhi to nahi chal raha hai aur... Mumbai mein 600 achchhi laundaries hai! Correction, 1000 se jyaada laundaries hai... Mai achchhi laundaries ki baat kar rahi hu Indravardhan... 400 laundaries suburbs mein hai, jaha par middle class auratein sofa cum bed covers dhulwaati hai...mai..",2,"Mai achchhi laundaries ki baat kar rahi hu Indravardhan... 400 laundaries suburbs mein hai, jaha par middle class auratein sofa cum bed covers dhulwaati hai...mai..","Radhabai chhutti pe gayi hai.. I mean, I mean, Maya suno, ghar ka washing machine bhi to nahi chal raha hai aur... Mumbai mein 600 achchhi laundaries hai! Correction, 1000 se jyaada laundaries hai...","Radhabai chhutti pe gayi hai.. I mean, I mean, Maya suno, ghar ka washing machine bhi to nahi chal raha hai aur... Mumbai mein 600 achchhi laundaries hai! Correction, 1000 se jyaada laundaries hai... Mai achchhi laundaries ki baat kar rahi hu Indravardhan... 400 laundaries suburbs mein hai, jaha par middle class auratein sofa cum bed covers dhulwaati hai...mai..",radhabai chuti pe gayi hai mean mean maya sunu ghar ka vash machin bhi tu nahi chal raha hai aur mumbai mein 60 achchi laundari hai curectiun 10 se jyada laundari hai mai achchi laundari ki bat kar rahi hu indravardhan 40 laundari suburb mein hai jaha par midl cla auratein sufa cum bed cuver dhulvati hai mai
12,"To mai kya! Kya, divorce de doge? Ha to do na, abhi isi waqt do. Mai bhi dekhti hu ki tumme himmat kitni hai! Chalo do na, do! Divorce matlab 100 Rs che chuute nahi hai, jki wallet check kiya aur zhat se diya!",0,"Divorce matlab 100 Rs che chuute nahi hai, jki wallet check kiya aur zhat se diya!","To mai kya! Kya, divorce de doge? Ha to do na, abhi isi waqt do. Mai bhi dekhti hu ki tumme himmat kitni hai! Chalo do na, do!","To mai kya! Kya, divorce de doge? Ha to do na, abhi isi waqt do. Mai bhi dekhti hu ki tumme himmat kitni hai! Chalo do na, do! Divorce matlab 100 Rs che chuute nahi hai, jki wallet check kiya aur zhat se diya!",tu mai kya kya divurc de duge ha tu du na abhi isi vakt du mai bhi dekhti hu ki tume himat kitni hai chalu du na du divurc matlab 10 rs che chute nahi hai jki valet check kiya aur jhat se diya
13,How middle class can you get? Maya ab tum is Waqt kahan middle class ki maravat Karne baith gai? Nahin Nahin main sabit karne ki koshish kar rahi hun Ki Kyon rosesh Footpath per gadi chala raha tha use downmarket barat se bachne ki koshish kar raha tha you know. You understand sir Yahi Yahi argument aap Court mein karna chalo,0,Yahi Yahi argument aap Court mein karna chalo,How middle class can you get? Maya ab tum is Waqt kahan middle class ki maravat Karne baith gai? Nahin Nahin main sabit karne ki koshish kar rahi hun Ki Kyon rosesh Footpath per gadi chala raha tha use downmarket barat se bachne ki koshish kar raha tha you know. You understand sir,How middle class can you get? Maya ab tum is Waqt kahan middle class ki maravat Karne baith gai? Nahin Nahin main sabit karne ki koshish kar rahi hun Ki Kyon rosesh Footpath per gadi chala raha tha use downmarket barat se bachne ki koshish kar raha tha you know. You understand sir Yahi Yahi argument aap Court mein karna chalo,huv midl cla yu get maya ab tum wakt kahan midl cla ki maravat karn baith gai nahin nahin main sabit karn ki kushish kar rahi hun ki kyun rusesh futpath per gadi chala raha tha use duvnmarket barat se bachn ki kushish kar raha tha yu knuv yu understand sir yahi yahi argument ap curt mein karna chalu
14,Rosesh! Momma! My Rosesh! My Momma! Mom! Rosesh ko jaldi batane do warna Monisha aa jaegi!,0,Mom! Rosesh ko jaldi batane do warna Monisha aa jaegi!,Rosesh! Momma! My Rosesh! My Momma!,Rosesh! Momma! My Rosesh! My Momma! Mom! Rosesh ko jaldi batane do warna Monisha aa jaegi!,rusesh muma rusesh muma mum rusesh ku jaldi batan du varna munisha jaegi
15,"Monisha mai tumhe party me nahi le ja sakta, mai mom ko le ja raha hu... I hope you don't mind that... I hate you! kutte kamine haramzade! jab mujhe le kar hi nehi jana tha toh mujhe jhute sapne kyun dikhaye!? mai ye ghar saaf e na karti na Jhoote, makkar mummy ke chamche! I hate you! Mai ghar chod ke ja rahi hu!",0,"Jhoote, makkar mummy ke chamche! I hate you! Mai ghar chod ke ja rahi hu!","Monisha mai tumhe party me nahi le ja sakta, mai mom ko le ja raha hu... I hope you don't mind that... I hate you! kutte kamine haramzade! jab mujhe le kar hi nehi jana tha toh mujhe jhute sapne kyun dikhaye!? mai ye ghar saaf e na karti na","Monisha mai tumhe party me nahi le ja sakta, mai mom ko le ja raha hu... I hope you don't mind that... I hate you! kutte kamine haramzade! jab mujhe le kar hi nehi jana tha toh mujhe jhute sapne kyun dikhaye!? mai ye ghar saaf e na karti na Jhoote, makkar mummy ke chamche! I hate you! Mai ghar chod ke ja rahi hu!",munisha mai tumh parti nahi le ja sakta mai mum ku le ja raha hu hupe yu dun mind hate yu kute kamin haramjad jab mujh le kar hi nehi jana tha tuh mujh jhute sapn kyun dikhay mai ye ghar saf e na karti na jhute makar mumi ke chamch hate yu mai ghar chud ke ja rahi hu
16,"Aaj se tumhe sir Indravardhan Sarabhai kaha ke bulaaenge. Subha se shuru ho jaayenge, ""Sir, doodh pi leejiye sir. Excercise kar lijiye sir. Naha leejiye sir. Monisha ke tarah naakhoon mat chabaaeye sir! Darvaaja joor se mat slam karo Monisha. Machchar maar ke, ""Wow! Choutha machchar mara!"" mat bolo Monisha.",2,"Darvaaja joor se mat slam karo Monisha. Machchar maar ke, ""Wow! Choutha machchar mara!"" mat bolo Monisha.","Aaj se tumhe sir Indravardhan Sarabhai kaha ke bulaaenge. Subha se shuru ho jaayenge, ""Sir, doodh pi leejiye sir. Excercise kar lijiye sir. Naha leejiye sir. Monisha ke tarah naakhoon mat chabaaeye sir!","Aaj se tumhe sir Indravardhan Sarabhai kaha ke bulaaenge. Subha se shuru ho jaayenge, ""Sir, doodh pi leejiye sir. Excercise kar lijiye sir. Naha leejiye sir. Monisha ke tarah naakhoon mat chabaaeye sir! Darvaaja joor se mat slam karo Monisha. Machchar maar ke, ""Wow! Choutha machchar mara!"" mat bolo Monisha.",aaj se tumh sir indravardhan sarabhai kaha ke bulaeng subha se shuru hu jayeng sir dudh pi lejiy sir excercis kar lijiy sir naha lejiy sir munisha ke tarah nakhun mat chabaey sir darvaja jur se mat slam karu munisha machchar mar ke wuv chutha machchar mara mat bulu munisha
17,"acha hello dad, ye sunkar bilkul hasi nhi ayi.",2,"hello dad, ye sunkar bilkul hasi nhi ayi.",acha,"acha hello dad, ye sunkar bilkul hasi nhi ayi.",acha helu dad ye sunkar bilkul hasi nhi ayi
18,"24th February ko to aapne mujhe triple polio ka pahala dose dilwaaya tha momma! Haha, oh God! Lekin hum use celebrate to nahi kar sakte na beta. I mean cake pe kya likhenge, happy first polio dose day!?",2,"Haha, oh God! Lekin hum use celebrate to nahi kar sakte na beta. I mean cake pe kya likhenge, happy first polio dose day!?",24th February ko to aapne mujhe triple polio ka pahala dose dilwaaya tha momma!,"24th February ko to aapne mujhe triple polio ka pahala dose dilwaaya tha momma! Haha, oh God! Lekin hum use celebrate to nahi kar sakte na beta. I mean cake pe kya likhenge, happy first polio dose day!?",24th februari ku tu apn mujh tripl puliu ka pahala duse dilvaya tha muma haha uh gud lekin hum use celebr tu nahi kar sakt na beta mean cake pe kya likheng hapi first puliu duse day
19,uhh lift lift arey lift! eh lift ! oi oi .. aaaaa! kamina kahinka . ruko. ruko!!!! aapka dimaag toh thik hai!,0,aapka dimaag toh thik hai!,uhh lift lift arey lift! eh lift ! oi oi .. aaaaa! kamina kahinka . ruko. ruko!!!!,uhh lift lift arey lift! eh lift ! oi oi .. aaaaa! kamina kahinka . ruko. ruko!!!! aapka dimaag toh thik hai!,uh lift lift arey lift eh lift ui ui kamina kahinka ruku ruku apka dimag tuh thik hai
20,oh To fir Monisha jo balcony se bhaiya Ji bhaiya ji Chilla Rahi Hai vah Kyon Nahin Sunai deta Tumko Sahil thoda tikha Jyada god this is the limit stop her please just,0,god this is the limit stop her please just,oh To fir Monisha jo balcony se bhaiya Ji bhaiya ji Chilla Rahi Hai vah Kyon Nahin Sunai deta Tumko Sahil thoda tikha Jyada,oh To fir Monisha jo balcony se bhaiya Ji bhaiya ji Chilla Rahi Hai vah Kyon Nahin Sunai deta Tumko Sahil thoda tikha Jyada god this is the limit stop her please just,uh tu fir munisha ju balcuni se bhaiya ji bhaiya ji chila rahi hai vah kyun nahin sunai deta tumku sahil thuda tikha jyada gud limit stup pleas
21,"Sahil, aaj agar meri jindagi ka aakhiri din hai, to hum ek hi tahali mein khaaenge... Theek hai... Sheera! Chalo, Chalo, Chalo! Aray jaldi chalo! Aray Mega mall mein giant sale hai, mai Tumhe vaha Chod deta hun! Chalo, Chalo, Chalo!",1,"Chalo, Chalo, Chalo! Aray jaldi chalo! Aray Mega mall mein giant sale hai, mai Tumhe vaha Chod deta hun! Chalo, Chalo, Chalo!","Sahil, aaj agar meri jindagi ka aakhiri din hai, to hum ek hi tahali mein khaaenge... Theek hai... Sheera!","Sahil, aaj agar meri jindagi ka aakhiri din hai, to hum ek hi tahali mein khaaenge... Theek hai... Sheera! Chalo, Chalo, Chalo! Aray jaldi chalo! Aray Mega mall mein giant sale hai, mai Tumhe vaha Chod deta hun! Chalo, Chalo, Chalo!",sahil aj agar meri jindagi ka akhiri din hai tu hum ek hi tahali mein khaeng thek hai shera chalu chalu chalu aray jaldi chalu aray mega mal mein giant sale hai mai tumh vaha chud deta hun chalu chalu chalu
22,mom uska cell phone switched off a raha hai han vah battery bachat Rahi Hogi na cello ko Bar Bar recharge karne se Ghar Ki electricity ka bill Jo badh jata hai 10 12 rupaye Maya Monisha Mardan baad me karna. tum dekh rahi ho na Kitna pareshan hai sahil,0,Maya Monisha Mardan baad me karna. tum dekh rahi ho na Kitna pareshan hai sahil,mom uska cell phone switched off a raha hai han vah battery bachat Rahi Hogi na cello ko Bar Bar recharge karne se Ghar Ki electricity ka bill Jo badh jata hai 10 12 rupaye,mom uska cell phone switched off a raha hai han vah battery bachat Rahi Hogi na cello ko Bar Bar recharge karne se Ghar Ki electricity ka bill Jo badh jata hai 10 12 rupaye Maya Monisha Mardan baad me karna. tum dekh rahi ho na Kitna pareshan hai sahil,mum uska cel phune svitch uf raha hai han vah bateri bachat rahi hugi na celu ku bar bar recharg karn se ghar ki electr ka bil ju badh jata hai 10 12 rupay maya munisha mardan bad karna tum dekh rahi hu na kitna pareshan hai sahil
23,"Monisha, coffee banaane mein itani der kyu lag rahi hai tumhe? Coffee banaani to tumhe aati hai na Monisha, yaad hai last year tumane banaae thi.",2,"Coffee banaani to tumhe aati hai na Monisha, yaad hai last year tumane banaae thi.","Monisha, coffee banaane mein itani der kyu lag rahi hai tumhe?","Monisha, coffee banaane mein itani der kyu lag rahi hai tumhe? Coffee banaani to tumhe aati hai na Monisha, yaad hai last year tumane banaae thi.",munisha cufe banan mein itani der kyu lag rahi hai tumh cufe banani tu tumh ati hai na munisha yad hai last year tuman bana thi
24,"vah bahut upset Thi mom I know vo yahan ayi thi kya kah rahi thi Mummy ji kahan Suna maaf, bye. fir ho sake Hum donon Na Mile all that... main use samjhaya Jindagi Bhagwan Ki bhot mahangi gift hai use Khud Khushi Karke Yun Waste mat karo. right aur fir mahangi aur wate Saath-Saath sunkar uski Aankhen Chamak gai. vah Kuchh Nahin Karegi don't worry",2,aur fir mahangi aur wate Saath-Saath sunkar uski Aankhen Chamak gai. vah Kuchh Nahin Karegi don't worry,"vah bahut upset Thi mom I know vo yahan ayi thi kya kah rahi thi Mummy ji kahan Suna maaf, bye. fir ho sake Hum donon Na Mile all that... main use samjhaya Jindagi Bhagwan Ki bhot mahangi gift hai use Khud Khushi Karke Yun Waste mat karo. right","vah bahut upset Thi mom I know vo yahan ayi thi kya kah rahi thi Mummy ji kahan Suna maaf, bye. fir ho sake Hum donon Na Mile all that... main use samjhaya Jindagi Bhagwan Ki bhot mahangi gift hai use Khud Khushi Karke Yun Waste mat karo. right aur fir mahangi aur wate Saath-Saath sunkar uski Aankhen Chamak gai. vah Kuchh Nahin Karegi don't worry",vah bahut upset thi mum knuv vu yahan ayi thi kya kah rahi thi mumi ji kahan suna maf bye fir hu sake hum dunun na mile al main use samjhaya jindagi bhagvan ki bhut mahangi gift hai use khud khushi kark yun wast mat karu right aur fir mahangi aur vate sath sath sunkar uski aankhen chamak gai vah kuch nahin karegi dun vuri
