,text,emotion,target_utterance,context_utterances,full_text,text_cleaned
418,"Are uske badan me se train ke third class compartment jesi boo ati hai! To dad, use aap Paas bethaiye aur usko uski problem bataiye Tu pagal ho gaya hai? Wo sath bethegi to Mujhe Apni Saans rokni padegi fir main baat Kaise karunga? Dad don't exaggerate Mein Baat Karta Hun usse Are bade Sahab, rosesh Baba uth hi Nahin rahe hain. maine unko Aise Aise uthane ki koshish ki, lekin wo mujhe Dekh Kar Munh Chhupa Kar so Hi Gaye! Naturally. Are haan, bai wo Sahil ko Tumse Kuchh kam hai to zara kareeb ao aur pucho Unse Ki Kya Kam Hai? Kya hai sahil bhai? Main actually bhul gaya Ki Kya Kam the. me...",2,Main actually bhul gaya Ki Kya Kam the. me...,"Are uske badan me se train ke third class compartment jesi boo ati hai! To dad, use aap Paas bethaiye aur usko uski problem bataiye Tu pagal ho gaya hai? Wo sath bethegi to Mujhe Apni Saans rokni padegi fir main baat Kaise karunga? Dad don't exaggerate Mein Baat Karta Hun usse Are bade Sahab, rosesh Baba uth hi Nahin rahe hain. maine unko Aise Aise uthane ki koshish ki, lekin wo mujhe Dekh Kar Munh Chhupa Kar so Hi Gaye! Naturally. Are haan, bai wo Sahil ko Tumse Kuchh kam hai to zara kareeb ao aur pucho Unse Ki Kya Kam Hai? Kya hai sahil bhai?","Are uske badan me se train ke third class compartment jesi boo ati hai! To dad, use aap Paas bethaiye aur usko uski problem bataiye Tu pagal ho gaya hai? Wo sath bethegi to Mujhe Apni Saans rokni padegi fir main baat Kaise karunga? Dad don't exaggerate Mein Baat Karta Hun usse Are bade Sahab, rosesh Baba uth hi Nahin rahe hain. maine unko Aise Aise uthane ki koshish ki, lekin wo mujhe Dekh Kar Munh Chhupa Kar so Hi Gaye! Naturally. Are haan, bai wo Sahil ko Tumse Kuchh kam hai to zara kareeb ao aur pucho Unse Ki Kya Kam Hai? Kya hai sahil bhai? Main actually bhul gaya Ki Kya Kam the. me...",usk badan se train ke third cla cumpart jesi bu ati hai tu dad use ap pa bethaiy aur usku uski prublem bataiy tu pagal hu gaya hai wu sath bethegi tu mujh apni san rukni padegi fir main bat kais karunga dad dun exager mein bat karta hun use bade sahab rusesh baba uth hi nahin rahe hain main unku ais ais uthan ki kushish ki lekin vu mujh dekh kar munh chupa kar su hi gay naturali han bai vu sahil ku tums kuch kam hai tu jara kareb au aur puchu uns ki kya kam hai kya hai sahil bhai main actuali bhul gaya ki kya kam
419,"Daddy ji, maine matkaadhar baba se mannat maangi thi, safal ho gayi! New baba! Beta, vo tumhare kaun the, Murlidhar baba...",2,"New baba! Beta, vo tumhare kaun the, Murlidhar baba...","Daddy ji, maine matkaadhar baba se mannat maangi thi, safal ho gayi!","Daddy ji, maine matkaadhar baba se mannat maangi thi, safal ho gayi! New baba! Beta, vo tumhare kaun the, Murlidhar baba...",dadi ji main matkadhar baba se manat mangi thi safal hu gayi nev baba beta vu tumhar kaun murlidhar baba
420,"and im depending on you huh sahil, tum iss ghar ka dhyan rakhoge, me nhi chaahati jab me wapas aau yahan kabutar udd rhe ho are maya, what do you mean, me kya school boy hun kya primary section ke or mummy ki absense me school boys kya karte hai, you know.",2,"primary section ke or mummy ki absense me school boys kya karte hai, you know.","and im depending on you huh sahil, tum iss ghar ka dhyan rakhoge, me nhi chaahati jab me wapas aau yahan kabutar udd rhe ho are maya, what do you mean, me kya school boy hun kya","and im depending on you huh sahil, tum iss ghar ka dhyan rakhoge, me nhi chaahati jab me wapas aau yahan kabutar udd rhe ho are maya, what do you mean, me kya school boy hun kya primary section ke or mummy ki absense me school boys kya karte hai, you know.",im depend un yu huh sahil tum ghar ka dhyan rakhug nhi chahati jab vapa au yahan kabutar ud rhe hu maya vhat du yu mean kya schul buy hun kya primari sectiun ke ur mumi ki absens schul buy kya kart hai yu knuv
421,"kya kahegi bhabhi Yahi ke Meri Sans Meri e sasur ko dominate karti hai, Beton ko remote control se chalati hai, Meri Sans ke khane ke dant alag chabane ki dant Alag,. dil mein Khoon karne ki ichcha hone par bhi Chehre par Meethi Meethi Muskan rakhti Hai Meri Saans. Meri Sans Ek hippocratic high society creature hai.",2,"Yahi ke Meri Sans Meri e sasur ko dominate karti hai, Beton ko remote control se chalati hai, Meri Sans ke khane ke dant alag chabane ki dant Alag,. dil mein Khoon karne ki ichcha hone par bhi Chehre par Meethi Meethi Muskan rakhti Hai Meri Saans. Meri Sans Ek hippocratic high society creature hai.",kya kahegi bhabhi,"kya kahegi bhabhi Yahi ke Meri Sans Meri e sasur ko dominate karti hai, Beton ko remote control se chalati hai, Meri Sans ke khane ke dant alag chabane ki dant Alag,. dil mein Khoon karne ki ichcha hone par bhi Chehre par Meethi Meethi Muskan rakhti Hai Meri Saans. Meri Sans Ek hippocratic high society creature hai.",kya kahegi bhabhi yahi ke meri san meri e sasur ku dumin karti hai betun ku remut cuntrul se chalati hai meri san ke khane ke dant alag chaban ki dant alag dil mein khun karn ki ichcha hune par bhi chehr par methi methi muskan rakhti hai meri san meri san ek hipucrat high sucieti creatur hai
422,kuch nahi ho sakta. is kachre ke dher mein jo thoda sa bedroom Chhupa hai na yah Kuchh Nahin ho sakta Monisha ise Thoda Aur bedroom banana Hoga Na Mummy Ji Main saaf Safai To Ki Hai dekhiae Bistar per Ek bhi sabji Nahin Hai aur wo Jo rajma Pada Hai Uska Kya? aur I mean Ek Taraf rajma aur dusri Taraf Surti Komal chawal. Monisha Tumhara To chawal bhi middle class hai.,2,aur wo Jo rajma Pada Hai Uska Kya? aur I mean Ek Taraf rajma aur dusri Taraf Surti Komal chawal. Monisha Tumhara To chawal bhi middle class hai.,kuch nahi ho sakta. is kachre ke dher mein jo thoda sa bedroom Chhupa hai na yah Kuchh Nahin ho sakta Monisha ise Thoda Aur bedroom banana Hoga Na Mummy Ji Main saaf Safai To Ki Hai dekhiae Bistar per Ek bhi sabji Nahin Hai,kuch nahi ho sakta. is kachre ke dher mein jo thoda sa bedroom Chhupa hai na yah Kuchh Nahin ho sakta Monisha ise Thoda Aur bedroom banana Hoga Na Mummy Ji Main saaf Safai To Ki Hai dekhiae Bistar per Ek bhi sabji Nahin Hai aur wo Jo rajma Pada Hai Uska Kya? aur I mean Ek Taraf rajma aur dusri Taraf Surti Komal chawal. Monisha Tumhara To chawal bhi middle class hai.,kuch nahi hu sakta kachr ke dher mein ju thuda sa bedrum chupa hai na yah kuch nahin hu sakta munisha ise thuda aur bedrum banana huga na mumi ji main saf safai tu ki hai dekhia bistar per ek bhi sabji nahin hai aur vu ju rajma pada hai uska kya aur mean ek taraf rajma aur dusri taraf surti kumal chaval munisha tumhara tu chaval bhi midl cla hai
423,"May I come in? Aa jaaiye na mummy ji, iss mein poochne ki kya baat hai? Nahi, kisi ke kamre mein aane se pehle jara pooch... Par ye to sabzi mandi hai! Yahan poochne ki koi jaroorat nahi hai!",2,"Nahi, kisi ke kamre mein aane se pehle jara pooch... Par ye to sabzi mandi hai! Yahan poochne ki koi jaroorat nahi hai!","May I come in? Aa jaaiye na mummy ji, iss mein poochne ki kya baat hai?","May I come in? Aa jaaiye na mummy ji, iss mein poochne ki kya baat hai? Nahi, kisi ke kamre mein aane se pehle jara pooch... Par ye to sabzi mandi hai! Yahan poochne ki koi jaroorat nahi hai!",may cume aa jaiy na mumi ji mein puchn ki kya bat hai nahi kisi ke kamr mein ane se pehl jara puch par ye tu sabji mandi hai yahan puchn ki kui jarurat nahi hai
424,"I hate him. I hate him Momma! Dad, dad aap kyu karte hain aisa. Rosesh ke sar par doodh ka glass khali kar ke kya mila aap ko? Sukoon! Anand, Chain, Aaram! Aatma kothandak, dil ko khussi, aur chehare ko muskaan! Dad, ki baat mein dam to hai Mom! Kya dum hain Sahil! I mean Monisha ki baatein sunkar mera bhi jee karta hai ki paani ka glass daalu uss ke saar pe, aur vo bhi yu dur se aise phenke, maaru uss ke sir pe!",2,"Kya dum hain Sahil! I mean Monisha ki baatein sunkar mera bhi jee karta hai ki paani ka glass daalu uss ke saar pe, aur vo bhi yu dur se aise phenke, maaru uss ke sir pe!","I hate him. I hate him Momma! Dad, dad aap kyu karte hain aisa. Rosesh ke sar par doodh ka glass khali kar ke kya mila aap ko? Sukoon! Anand, Chain, Aaram! Aatma kothandak, dil ko khussi, aur chehare ko muskaan! Dad, ki baat mein dam to hai Mom!","I hate him. I hate him Momma! Dad, dad aap kyu karte hain aisa. Rosesh ke sar par doodh ka glass khali kar ke kya mila aap ko? Sukoon! Anand, Chain, Aaram! Aatma kothandak, dil ko khussi, aur chehare ko muskaan! Dad, ki baat mein dam to hai Mom! Kya dum hain Sahil! I mean Monisha ki baatein sunkar mera bhi jee karta hai ki paani ka glass daalu uss ke saar pe, aur vo bhi yu dur se aise phenke, maaru uss ke sir pe!",hate hate muma dad dad ap kyu kart hain aisa rusesh ke sar par dudh ka gla khali kar ke kya mila ap ku sukun anand chain aaram aatma kuthandak dil ku khusi aur chehar ku muskan dad ki bat mein dam tu hai mum kya dum hain sahil mean munisha ki batein sunkar mera bhi je karta hai ki pani ka gla dalu us ke sar pe aur vu bhi yu dur se ais phenk maru us ke sir pe
425,"Monisha, dates ke mamle mein mard jara kamzor hai. Ye baat agar mai tumhe prove kar dun to? Want to bet? okay, lag gayi 10-10 ki! 10? I'm impressed!",2,10? I'm impressed!,"Monisha, dates ke mamle mein mard jara kamzor hai. Ye baat agar mai tumhe prove kar dun to? Want to bet? okay, lag gayi 10-10 ki!","Monisha, dates ke mamle mein mard jara kamzor hai. Ye baat agar mai tumhe prove kar dun to? Want to bet? okay, lag gayi 10-10 ki! 10? I'm impressed!",munisha date ke maml mein mard jara kamjur hai ye bat agar mai tumh pruve kar dun tu want tu bet ukay lag gayi 10 10 ki 10 impres
426,Pichle 20 saal mein Monisha ne baat tak nahi ki onse. To 20 saal ka ek saat mein ro rahi hoon na Mummyji!,3,To 20 saal ka ek saat mein ro rahi hoon na Mummyji!,Pichle 20 saal mein Monisha ne baat tak nahi ki onse.,Pichle 20 saal mein Monisha ne baat tak nahi ki onse. To 20 saal ka ek saat mein ro rahi hoon na Mummyji!,pichl 20 sal mein munisha ne bat tak nahi ki uns tu 20 sal ka ek sat mein ru rahi hun na mumyji
427,"Right pain pain, rosesh, come on! aahhh. ese pain Nahin yah overacting ho jayegi momma. Rosesh wo log Sab middle class Honge bichare Hindi filmon ke Shaukeen, unhe over acting acchi Lagegi Tum karo na.",2,"Rosesh wo log Sab middle class Honge bichare Hindi filmon ke Shaukeen, unhe over acting acchi Lagegi Tum karo na.","Right pain pain, rosesh, come on! aahhh. ese pain Nahin yah overacting ho jayegi momma.","Right pain pain, rosesh, come on! aahhh. ese pain Nahin yah overacting ho jayegi momma. Rosesh wo log Sab middle class Honge bichare Hindi filmon ke Shaukeen, unhe over acting acchi Lagegi Tum karo na.",right pain pain rusesh cume un ah ese pain nahin yah uveract hu jayegi muma rusesh vu lug sab midl cla hung bichar hindi filmun ke shauken unh uver act achi lagegi tum karu na
428,"Zodiac Bistro? Tum vaha kya kar rahe ho? Tum to doctor ke paas gaye the na? Umm, haan.., Infact unhone hi kaha ki mai mom ko kisi relaxed atmosphere mein le aau, taaki you know, vo khul kar baat kar sake... Achchha theek hai, tum uss doctor ko vahi rok ke rakhna! Mai abhi aa ke uski akal theekane lagati hu, okay? Aray, nahi, nahi! Sunno... Tum suno! Vaha par khaane ke liye kuch mat mangwaana, bohot mehenga restaurant hai, samjhe? Aray ab to meri bhookh humesha ke liye mar chuki hai! Achchha, mai tumhaare liye lassi lekar aati hu, theek hai? Nahi, nahi! Monisha! Monisha... Sahil, beta lunch order kare? Umm, aap order kijiye mom, tab tak mai ek doctor order karta hu...",0,"Umm, aap order kijiye mom, tab tak mai ek doctor order karta hu...","Zodiac Bistro? Tum vaha kya kar rahe ho? Tum to doctor ke paas gaye the na? Umm, haan.., Infact unhone hi kaha ki mai mom ko kisi relaxed atmosphere mein le aau, taaki you know, vo khul kar baat kar sake... Achchha theek hai, tum uss doctor ko vahi rok ke rakhna! Mai abhi aa ke uski akal theekane lagati hu, okay? Aray, nahi, nahi! Sunno... Tum suno! Vaha par khaane ke liye kuch mat mangwaana, bohot mehenga restaurant hai, samjhe? Aray ab to meri bhookh humesha ke liye mar chuki hai! Achchha, mai tumhaare liye lassi lekar aati hu, theek hai? Nahi, nahi! Monisha! Monisha... Sahil, beta lunch order kare?","Zodiac Bistro? Tum vaha kya kar rahe ho? Tum to doctor ke paas gaye the na? Umm, haan.., Infact unhone hi kaha ki mai mom ko kisi relaxed atmosphere mein le aau, taaki you know, vo khul kar baat kar sake... Achchha theek hai, tum uss doctor ko vahi rok ke rakhna! Mai abhi aa ke uski akal theekane lagati hu, okay? Aray, nahi, nahi! Sunno... Tum suno! Vaha par khaane ke liye kuch mat mangwaana, bohot mehenga restaurant hai, samjhe? Aray ab to meri bhookh humesha ke liye mar chuki hai! Achchha, mai tumhaare liye lassi lekar aati hu, theek hai? Nahi, nahi! Monisha! Monisha... Sahil, beta lunch order kare? Umm, aap order kijiye mom, tab tak mai ek doctor order karta hu...",zudiac bistru tum vaha kya kar rahe hu tum tu ductur ke pa gay na um han infact unhun hi kaha ki mai mum ku kisi relax atmuspher mein le au taki yu knuv vu khul kar bat kar sake achcha thek hai tum us ductur ku vahi ruk ke rakhna mai abhi ke uski akal thekan lagati hu ukay aray nahi nahi sunu tum sunu vaha par khane ke liy kuch mat mangvana buhut mehenga restaur hai samjh aray ab tu meri bhukh humesha ke liy mar chuki hai achcha mai tumhar liy lasi lekar ati hu thek hai nahi nahi munisha munisha sahil beta lunch urder kare um ap urder kijiy mum tab tak mai ek ductur urder karta hu
429,"Haan, aur Maya desi daaru center ke bagal mein hi, Akhbar kabaadivaale ki dukaan hai! Kabaadivaala! Haan! Jaha vo puraani cheeze repair kar ke bechta hai! Daddy ji to usse 2000 rupaye de kar aaye the... magar mein 400 rupaye vaapas le ke aa gayi! Congratulations!",2,Congratulations!,"Haan, aur Maya desi daaru center ke bagal mein hi, Akhbar kabaadivaale ki dukaan hai! Kabaadivaala! Haan! Jaha vo puraani cheeze repair kar ke bechta hai! Daddy ji to usse 2000 rupaye de kar aaye the... magar mein 400 rupaye vaapas le ke aa gayi!","Haan, aur Maya desi daaru center ke bagal mein hi, Akhbar kabaadivaale ki dukaan hai! Kabaadivaala! Haan! Jaha vo puraani cheeze repair kar ke bechta hai! Daddy ji to usse 2000 rupaye de kar aaye the... magar mein 400 rupaye vaapas le ke aa gayi! Congratulations!",han aur maya desi daru center ke bagal mein hi akhbar kabadival ki dukan hai kabadivala han jaha vu purani cheje repair kar ke bechta hai dadi ji tu use 20 rupay de kar aye magar mein 40 rupay vapa le ke gayi cungratulatiun
430,"haila, maya tumne ise select nhi kiya. Ram banaye jodi, champa javeri, rosesh dekh to Indravardhan... momma, chimpanzee nhi nhi gendi bhi hai dekh, tere bache ke sath",2,"nhi nhi gendi bhi hai dekh, tere bache ke sath","haila, maya tumne ise select nhi kiya. Ram banaye jodi, champa javeri, rosesh dekh to Indravardhan... momma, chimpanzee","haila, maya tumne ise select nhi kiya. Ram banaye jodi, champa javeri, rosesh dekh to Indravardhan... momma, chimpanzee nhi nhi gendi bhi hai dekh, tere bache ke sath",haila maya tumn ise select nhi kiya ram banay judi champa javeri rusesh dekh tu indravardhan muma chimpanj nhi nhi gendi bhi hai dekh tere bach ke sath
431,"Ye lo. Danish cookies ke dabbe hai. tumhaare bathroom mein ja ke rakh do. Lekin humare bathroom mein already Sad dabbe hai daddy ji! Aray pagali! Ye bhare hue dabbe hai. Tumhe chupaane ke liye de raha hu, saabun rakhaane ke liye nahi!",1,"Aray pagali! Ye bhare hue dabbe hai. Tumhe chupaane ke liye de raha hu, saabun rakhaane ke liye nahi!",Ye lo. Danish cookies ke dabbe hai. tumhaare bathroom mein ja ke rakh do. Lekin humare bathroom mein already Sad dabbe hai daddy ji!,"Ye lo. Danish cookies ke dabbe hai. tumhaare bathroom mein ja ke rakh do. Lekin humare bathroom mein already Sad dabbe hai daddy ji! Aray pagali! Ye bhare hue dabbe hai. Tumhe chupaane ke liye de raha hu, saabun rakhaane ke liye nahi!",ye lu danish cuki ke dabe hai tumhar bathrum mein ja ke rakh du lekin humar bathrum mein alreadi sad dabe hai dadi ji aray pagali ye bhare hue dabe hai tumh chupan ke liy de raha hu sabun rakhan ke liy nahi
432,"Monisha, ek tumbler kharaab ko kya saare tumbler kharaab? Kal kya tu nahi kaha ki wahan se tu jo balti khareeda tha wo bohot majboot aur paisa wasool nikli? Kaha tha! Fir? Ho saakta ki Naisha tumbler nahi, baalti ho!",3,"Fir? Ho saakta ki Naisha tumbler nahi, baalti ho!","Monisha, ek tumbler kharaab ko kya saare tumbler kharaab? Kal kya tu nahi kaha ki wahan se tu jo balti khareeda tha wo bohot majboot aur paisa wasool nikli? Kaha tha!","Monisha, ek tumbler kharaab ko kya saare tumbler kharaab? Kal kya tu nahi kaha ki wahan se tu jo balti khareeda tha wo bohot majboot aur paisa wasool nikli? Kaha tha! Fir? Ho saakta ki Naisha tumbler nahi, baalti ho!",munisha ek tumbler kharab ku kya sare tumbler kharab kal kya tu nahi kaha ki vahan se tu ju balti khareda tha vu buhut majbut aur paisa vasul nikli kaha tha fir hu sakta ki naisha tumbler nahi balti hu
433,"Mai bachchhon ke saath competition nahi kar rahi thi, Indravardhan! Lekin scrabble to bachchhon ka hi game hai na! Says who!? Scrabble sab khel sakte hai, bachchhe khel sakte hai, intelligent adults khel sakte hai... Monisha bhi khel rahi hai!",2,"Says who!? Scrabble sab khel sakte hai, bachchhe khel sakte hai, intelligent adults khel sakte hai... Monisha bhi khel rahi hai!","Mai bachchhon ke saath competition nahi kar rahi thi, Indravardhan! Lekin scrabble to bachchhon ka hi game hai na!","Mai bachchhon ke saath competition nahi kar rahi thi, Indravardhan! Lekin scrabble to bachchhon ka hi game hai na! Says who!? Scrabble sab khel sakte hai, bachchhe khel sakte hai, intelligent adults khel sakte hai... Monisha bhi khel rahi hai!",mai bachchun ke sath cumpetitiun nahi kar rahi thi indravardhan lekin scrabl tu bachchun ka hi game hai na say vhu scrabl sab khel sakt hai bachch khel sakt hai intelig adult khel sakt hai munisha bhi khel rahi hai
434,Ok kal jo tiffin main tumne mujhe khana diya tha wo sabji maine bilkul fresh Banai thi aur aur tiffin bhi acchi Tarah Se dhoya tha haila,1,haila,Ok kal jo tiffin main tumne mujhe khana diya tha wo sabji maine bilkul fresh Banai thi aur aur tiffin bhi acchi Tarah Se dhoya tha,Ok kal jo tiffin main tumne mujhe khana diya tha wo sabji maine bilkul fresh Banai thi aur aur tiffin bhi acchi Tarah Se dhoya tha haila,ok kal ju tifin main tumn mujh khana diya tha vu sabji main bilkul fresh banai thi aur aur tifin bhi achi tarah se dhuya tha haila
435,toh mei bhi aapki tarah mehnat karunga nayi Kavitaen likhunga . infact 35 toh likh bhi daali hai sunau? nahi nahi yahan nahi yahan pe bohot saara kachra hai toh tumhare yahan bethte hai mei wine leke aata hun Itmenaan se tumhari kavitaen sunenge,2,nahi nahi yahan nahi yahan pe bohot saara kachra hai toh tumhare yahan bethte hai mei wine leke aata hun Itmenaan se tumhari kavitaen sunenge,toh mei bhi aapki tarah mehnat karunga nayi Kavitaen likhunga . infact 35 toh likh bhi daali hai sunau?,toh mei bhi aapki tarah mehnat karunga nayi Kavitaen likhunga . infact 35 toh likh bhi daali hai sunau? nahi nahi yahan nahi yahan pe bohot saara kachra hai toh tumhare yahan bethte hai mei wine leke aata hun Itmenaan se tumhari kavitaen sunenge,tuh mei bhi apki tarah mehnat karunga nayi kavitaen likhunga infact 35 tuh likh bhi dali hai sunau nahi nahi yahan nahi yahan pe buhut sara kachra hai tuh tumhar yahan betht hai mei vine leke ata hun itmenan se tumhari kavitaen suneng
436,"Ye lijiye Chakna! And whisky, soda, and ice! Haha! Ye Indian whisky hai na... Of course! Monarch, Single Malt! Petrol pump se bharvaayi hogi na, bottle mein...",2,"Petrol pump se bharvaayi hogi na, bottle mein...","Ye lijiye Chakna! And whisky, soda, and ice! Haha! Ye Indian whisky hai na... Of course! Monarch, Single Malt!","Ye lijiye Chakna! And whisky, soda, and ice! Haha! Ye Indian whisky hai na... Of course! Monarch, Single Malt! Petrol pump se bharvaayi hogi na, bottle mein...",ye lijiy chakna vhiski suda ice haha ye indian vhiski hai na curs munarch singl malt petrul pump se bharvayi hugi na butl mein
437,Sahil chai Daddy ji rosesh bhaiya Ismein Thoda Jahar daal ke dijiye bhabhi Yah chai vaisi hi hai,3,Yah chai vaisi hi hai,Sahil chai Daddy ji rosesh bhaiya Ismein Thoda Jahar daal ke dijiye bhabhi,Sahil chai Daddy ji rosesh bhaiya Ismein Thoda Jahar daal ke dijiye bhabhi Yah chai vaisi hi hai,sahil chai dadi ji rusesh bhaiya ismein thuda jahar dal ke dijiy bhabhi yah chai vaisi hi hai
438,"Indravardhan! Hello..Hahaha..Achchha hua na maine apni mulaakaat ki pehali anniversary ke bare mein btaya nahi Maya ko..haan nahi to mai phas jata mai..khamaka... Haha Kisse baat kar rhe the tum intercom par? Mai...Haan, watchman se. You mean 24th february ko tumhaari aur watchman ki mulaakaat ki pehali anniversary hai!? kya keh rahi ho..maine..aisa kuch nahi kaha maine. Oh yes tumne aisa hi kaha. don't lie Indu! Good night. Indu..you..kaun hogi!? Mrs. Billeymorio, 7th floor..nahi nahi..she's too old for Indu... Revati Kapoor.. 5th floor..eh she smells! Hello Sahil, agar mardon ko tareekhein yaad nahi rehati, to auratein shak karna nahi chod sakti! Baj gaye Maya ke barah!",1,"Hello Sahil, agar mardon ko tareekhein yaad nahi rehati, to auratein shak karna nahi chod sakti! Baj gaye Maya ke barah!","Indravardhan! Hello..Hahaha..Achchha hua na maine apni mulaakaat ki pehali anniversary ke bare mein btaya nahi Maya ko..haan nahi to mai phas jata mai..khamaka... Haha Kisse baat kar rhe the tum intercom par? Mai...Haan, watchman se. You mean 24th february ko tumhaari aur watchman ki mulaakaat ki pehali anniversary hai!? kya keh rahi ho..maine..aisa kuch nahi kaha maine. Oh yes tumne aisa hi kaha. don't lie Indu! Good night. Indu..you..kaun hogi!? Mrs. Billeymorio, 7th floor..nahi nahi..she's too old for Indu... Revati Kapoor.. 5th floor..eh she smells!","Indravardhan! Hello..Hahaha..Achchha hua na maine apni mulaakaat ki pehali anniversary ke bare mein btaya nahi Maya ko..haan nahi to mai phas jata mai..khamaka... Haha Kisse baat kar rhe the tum intercom par? Mai...Haan, watchman se. You mean 24th february ko tumhaari aur watchman ki mulaakaat ki pehali anniversary hai!? kya keh rahi ho..maine..aisa kuch nahi kaha maine. Oh yes tumne aisa hi kaha. don't lie Indu! Good night. Indu..you..kaun hogi!? Mrs. Billeymorio, 7th floor..nahi nahi..she's too old for Indu... Revati Kapoor.. 5th floor..eh she smells! Hello Sahil, agar mardon ko tareekhein yaad nahi rehati, to auratein shak karna nahi chod sakti! Baj gaye Maya ke barah!",indravardhan helu hahaha achcha hua na main apni mulakat ki pehali aniversari ke bare mein btaya nahi maya ku han nahi tu mai pha jata mai khamaka haha kise bat kar rhe tum intercum par mai han vatchman se yu mean 24th februari ku tumhari aur vatchman ki mulakat ki pehali aniversari hai kya keh rahi hu main aisa kuch nahi kaha main oh ye tumn aisa hi kaha dun lie indu gud night indu yu kaun hugi mr bileymuriu 7th flur nahi nahi tu uld fur indu revati kapur 5th flur eh smel helu sahil agar mardun ku tarekhein yad nahi rehati tu auratein shak karna nahi chud sakti baj gay maya ke barah
439,"Momma, Soniya to keh rahi hai ki marne vaala koi mard nahi, balki koi aurat hai. Achchha! Marne vaali ka naam 'M' se shuru hota hai! Monisha!",1,Monisha!,"Momma, Soniya to keh rahi hai ki marne vaala koi mard nahi, balki koi aurat hai. Achchha! Marne vaali ka naam 'M' se shuru hota hai!","Momma, Soniya to keh rahi hai ki marne vaala koi mard nahi, balki koi aurat hai. Achchha! Marne vaali ka naam 'M' se shuru hota hai! Monisha!",muma suniya tu keh rahi hai ki marn vala kui mard nahi balki kui aurat hai achcha marn vali ka nam se shuru huta hai munisha
440,"But kyu? Tum apni kavita kyu chodh raheho sweety? Kyuki meri kavita ne humesha muze bura criticism hi diya hai momma, jise maine apni lifeline samjha, wohi meri dushman nikli. Very correct, infact tumhaari nahi, hum subki dushman nikli. So go ahead, cut the cake, congratuations, kavita se aajadi mubarak ho!",3,"So go ahead, cut the cake, congratuations, kavita se aajadi mubarak ho!","But kyu? Tum apni kavita kyu chodh raheho sweety? Kyuki meri kavita ne humesha muze bura criticism hi diya hai momma, jise maine apni lifeline samjha, wohi meri dushman nikli. Very correct, infact tumhaari nahi, hum subki dushman nikli.","But kyu? Tum apni kavita kyu chodh raheho sweety? Kyuki meri kavita ne humesha muze bura criticism hi diya hai momma, jise maine apni lifeline samjha, wohi meri dushman nikli. Very correct, infact tumhaari nahi, hum subki dushman nikli. So go ahead, cut the cake, congratuations, kavita se aajadi mubarak ho!",kyu tum apni kavita kyu chudh rahehu sveti kyuki meri kavita ne humesha muje bura critic hi diya hai muma jise main apni lifelin samjha vuhi meri dushman nikli curect infact tumhari nahi hum subki dushman nikli su gu ahead cut cake cungratuatiun kavita se ajadi mubarak hu
