,text,emotion,target_utterance,context_utterances,full_text,text_cleaned
212,"ke jo kaam kaaj. reverse karna ata nhi hai or ek crore barah lakh ki gadi chalane chali ho. kya pahad tut jata agar maya tumse pehle gadi chala leti? pehle me, pehle me, pehle me ki ratt lagaye bethi thi. haiila, daddy ji, aap hi ne to kaha tha. mujhe beech me mat ghaseeto huh monisha. me court me kuch nhi kehne wala judge ke samne. yes. court me? haan! jab sahil ko pta chalega tab wo tumhe court me to ghaseet ke le hi jaega na divorce ke liye. huh? kya? hahaha. maan gyi? are budhu me tumhari tang kheench rha tha. me or tu hai support me esa kabhi hua hai? aap support karenge na daddy ji? ye bhi koi puchne ki baat hai? divorce ke baad bhi tum mere hi sath rahogi!",0,ye bhi koi puchne ki baat hai? divorce ke baad bhi tum mere hi sath rahogi!,"ke jo kaam kaaj. reverse karna ata nhi hai or ek crore barah lakh ki gadi chalane chali ho. kya pahad tut jata agar maya tumse pehle gadi chala leti? pehle me, pehle me, pehle me ki ratt lagaye bethi thi. haiila, daddy ji, aap hi ne to kaha tha. mujhe beech me mat ghaseeto huh monisha. me court me kuch nhi kehne wala judge ke samne. yes. court me? haan! jab sahil ko pta chalega tab wo tumhe court me to ghaseet ke le hi jaega na divorce ke liye. huh? kya? hahaha. maan gyi? are budhu me tumhari tang kheench rha tha. me or tu hai support me esa kabhi hua hai? aap support karenge na daddy ji?","ke jo kaam kaaj. reverse karna ata nhi hai or ek crore barah lakh ki gadi chalane chali ho. kya pahad tut jata agar maya tumse pehle gadi chala leti? pehle me, pehle me, pehle me ki ratt lagaye bethi thi. haiila, daddy ji, aap hi ne to kaha tha. mujhe beech me mat ghaseeto huh monisha. me court me kuch nhi kehne wala judge ke samne. yes. court me? haan! jab sahil ko pta chalega tab wo tumhe court me to ghaseet ke le hi jaega na divorce ke liye. huh? kya? hahaha. maan gyi? are budhu me tumhari tang kheench rha tha. me or tu hai support me esa kabhi hua hai? aap support karenge na daddy ji? ye bhi koi puchne ki baat hai? divorce ke baad bhi tum mere hi sath rahogi!",ke ju kam kaj revers karna ata nhi hai ur ek crure barah lakh ki gadi chalan chali hu kya pahad tut jata agar maya tums pehl gadi chala leti pehl pehl pehl ki rat lagay bethi thi haila dadi ji ap hi ne tu kaha tha mujh bech mat ghasetu huh munisha curt kuch nhi kehn vala judg ke samn ye curt han jab sahil ku pta chalega tab vu tumh curt tu ghaset ke le hi jaega na divurc ke liy huh kya hahaha man gyi budhu tumhari tang khench rha tha ur tu hai supurt esa kabhi hua hai ap supurt kareng na dadi ji ye bhi kui puchn ki bat hai divurc ke bad bhi tum mere hi sath rahugi
213,You're right Indravardhan. Bhai humare maa-baap ne to hume cheekhaana chillana sikhaya hi nahi. Is maamale mein hum thode kamjor hai. Isiliye mai Monisha ko apne saath lekar ja rahi hu! Chalati firati loudspeaker! Hahaha.,2,Isiliye mai Monisha ko apne saath lekar ja rahi hu! Chalati firati loudspeaker! Hahaha.,You're right Indravardhan. Bhai humare maa-baap ne to hume cheekhaana chillana sikhaya hi nahi. Is maamale mein hum thode kamjor hai.,You're right Indravardhan. Bhai humare maa-baap ne to hume cheekhaana chillana sikhaya hi nahi. Is maamale mein hum thode kamjor hai. Isiliye mai Monisha ko apne saath lekar ja rahi hu! Chalati firati loudspeaker! Hahaha.,yu right indravardhan bhai humar bap ne tu hume chekhana chilana sikhaya hi nahi mamal mein hum thude kamjur hai isiliy mai munisha ku apn sath lekar ja rahi hu chalati firati ludspeak hahaha
214,"Monisha, Monisha! Haan? Vo dekho na, maan na maan, mai tera mehemaan.. Rummy khel rahe hai! Aray haan! Aray yo, phookatchando! Muft ka agar kha pi liya ho to chalo abhi antaakshari khelo! Chalo, chalo!",0,"Aray yo, phookatchando! Muft ka agar kha pi liya ho to chalo abhi antaakshari khelo! Chalo, chalo!","Monisha, Monisha! Haan? Vo dekho na, maan na maan, mai tera mehemaan.. Rummy khel rahe hai! Aray haan!","Monisha, Monisha! Haan? Vo dekho na, maan na maan, mai tera mehemaan.. Rummy khel rahe hai! Aray haan! Aray yo, phookatchando! Muft ka agar kha pi liya ho to chalo abhi antaakshari khelo! Chalo, chalo!",munisha munisha han vu dekhu na man na man mai tera meheman rumi khel rahe hai aray han aray yu phukatchandu muft ka agar kha pi liya hu tu chalu abhi antakshari khelu chalu chalu
215,"Aap ne! Poora cake! Usne to mujhe bola... Kya!? Mai kia vo... Jor se boliye! Mera koi kasoor nahi hai Sahil, inn donone mujhe ukasaaya isliye... Kin dono ne? Inn, inn dono ne! Ab bol na! Chup kyu hai! Tum bhi bolo! Ek to cake khaaya, vo ek paagal pan kiya! Ab aap actually paagal ho gaye hai! Aur dekha! Monishnaath swaami ji! Aap ki agani pariksha na nateeja! Pahali baar aksar insaan bhatak jaata hai Sahil. Lekin agali baar... Shut up! Shut up! Agali baar tum dad ke saamane detergent cake bhi nahi rakhogi!",0,Shut up! Shut up! Agali baar tum dad ke saamane detergent cake bhi nahi rakhogi!,"Aap ne! Poora cake! Usne to mujhe bola... Kya!? Mai kia vo... Jor se boliye! Mera koi kasoor nahi hai Sahil, inn donone mujhe ukasaaya isliye... Kin dono ne? Inn, inn dono ne! Ab bol na! Chup kyu hai! Tum bhi bolo! Ek to cake khaaya, vo ek paagal pan kiya! Ab aap actually paagal ho gaye hai! Aur dekha! Monishnaath swaami ji! Aap ki agani pariksha na nateeja! Pahali baar aksar insaan bhatak jaata hai Sahil. Lekin agali baar...","Aap ne! Poora cake! Usne to mujhe bola... Kya!? Mai kia vo... Jor se boliye! Mera koi kasoor nahi hai Sahil, inn donone mujhe ukasaaya isliye... Kin dono ne? Inn, inn dono ne! Ab bol na! Chup kyu hai! Tum bhi bolo! Ek to cake khaaya, vo ek paagal pan kiya! Ab aap actually paagal ho gaye hai! Aur dekha! Monishnaath swaami ji! Aap ki agani pariksha na nateeja! Pahali baar aksar insaan bhatak jaata hai Sahil. Lekin agali baar... Shut up! Shut up! Agali baar tum dad ke saamane detergent cake bhi nahi rakhogi!",aap ne pura cake usn tu mujh bula kya mai kia vu jur se buliy mera kui kasur nahi hai sahil dunun mujh ukasaya isliy kin dunu ne dunu ne ab bul na chup kyu hai tum bhi bulu ek tu cake khaya vu ek pagal pan kiya ab ap actuali pagal hu gay hai aur dekha munishnath svami ji aap ki agani pariksha na nateja pahali bar aksar insan bhatak jata hai sahil lekin agali bar shut shut agali bar tum dad ke saman deterg cake bhi nahi rakhugi
216,"Hum dono jaaenge, mai or mera darling beta! Umm, lekin Monisha! Tum Monisha ko lunch ke liye le jaana, I mean if you don't mind. But use Zodiac Bistro bilkul mat le jaana, warna vo to bechaari apane naakhoon chaba chaba kar hi pait bhar legi! Monisha naakhoon nhi chabaati hai mom... Zodiac Bistro ka menu dekhegi to jaroor chabaaegi! ""Haww! Mineral water 110 rupees! Haww!"" Aray to tum kyu bura maan rahe ho, I am just joking! Hahaha! Decided! Match is important, mai nahi aaunga! Thank you so much darling! isse achchha tohfa tum mujhe de hi nahi sakte the!",2,Thank you so much darling! isse achchha tohfa tum mujhe de hi nahi sakte the!,"Hum dono jaaenge, mai or mera darling beta! Umm, lekin Monisha! Tum Monisha ko lunch ke liye le jaana, I mean if you don't mind. But use Zodiac Bistro bilkul mat le jaana, warna vo to bechaari apane naakhoon chaba chaba kar hi pait bhar legi! Monisha naakhoon nhi chabaati hai mom... Zodiac Bistro ka menu dekhegi to jaroor chabaaegi! ""Haww! Mineral water 110 rupees! Haww!"" Aray to tum kyu bura maan rahe ho, I am just joking! Hahaha! Decided! Match is important, mai nahi aaunga!","Hum dono jaaenge, mai or mera darling beta! Umm, lekin Monisha! Tum Monisha ko lunch ke liye le jaana, I mean if you don't mind. But use Zodiac Bistro bilkul mat le jaana, warna vo to bechaari apane naakhoon chaba chaba kar hi pait bhar legi! Monisha naakhoon nhi chabaati hai mom... Zodiac Bistro ka menu dekhegi to jaroor chabaaegi! ""Haww! Mineral water 110 rupees! Haww!"" Aray to tum kyu bura maan rahe ho, I am just joking! Hahaha! Decided! Match is important, mai nahi aaunga! Thank you so much darling! isse achchha tohfa tum mujhe de hi nahi sakte the!",hum dunu jaeng mai ur mera darl beta um lekin munisha tum munisha ku lunch ke liy le jana mean yu dun mind use zudiac bistru bilkul mat le jana varna vu tu bechari apan nakhun chaba chaba kar hi pait bhar legi munisha nakhun nhi chabati hai mum zudiac bistru ka menu dekhegi tu jarur chabaegi hav miner vater 10 rupe hav aray tu tum kyu bura man rahe hu juke hahaha decid match impurt mai nahi aunga thank yu su much darl ise achcha tuhfa tum mujh de hi nahi sakt
217,"Aur kisne kya tha phone Rosesh ko? Ye credit card vaale vo, teleshopping vaali ladki. Waste of time! Maine kaha diya ki I am not interested. Ab mai samjhi, kisi ne tumhe kuch bechane ke liye Sad bar phone kiya aur tumne mana karne ke liye samne se 7 bar phone kiya!",2,"Ab mai samjhi, kisi ne tumhe kuch bechane ke liye Sad bar phone kiya aur tumne mana karne ke liye samne se 7 bar phone kiya!","Aur kisne kya tha phone Rosesh ko? Ye credit card vaale vo, teleshopping vaali ladki. Waste of time! Maine kaha diya ki I am not interested.","Aur kisne kya tha phone Rosesh ko? Ye credit card vaale vo, teleshopping vaali ladki. Waste of time! Maine kaha diya ki I am not interested. Ab mai samjhi, kisi ne tumhe kuch bechane ke liye Sad bar phone kiya aur tumne mana karne ke liye samne se 7 bar phone kiya!",aur kisn kya tha phune rusesh ku ye credit card vale vu teleshup vali ladki wast uf time main kaha diya ki nut interest ab mai samjhi kisi ne tumh kuch bechan ke liy sad bar phune kiya aur tumn mana karn ke liy samn se 7 bar phune kiya
218,keep quiet both of you please sahil tum jaa kar ke wo belt le aao please ye monisha ki bacchi le ayegi na . dewar ki chamchi. come on get his belt,0,ye monisha ki bacchi le ayegi na . dewar ki chamchi. come on get his belt,keep quiet both of you please sahil tum jaa kar ke wo belt le aao please,keep quiet both of you please sahil tum jaa kar ke wo belt le aao please ye monisha ki bacchi le ayegi na . dewar ki chamchi. come on get his belt,kep kuiet buth uf yu pleas sahil tum ja kar ke vu belt le au pleas ye munisha ki bachi le ayegi na devar ki chamchi cume un get belt
219,"Ahh.. Hein? Indravardhan, vo refrigerator repair vaale ko phone karo na baba. Humara fridge kharab ho gaya hai. Aur mera dimmakh bhe.",0,Aur mera dimmakh bhe.,"Ahh.. Hein? Indravardhan, vo refrigerator repair vaale ko phone karo na baba. Humara fridge kharab ho gaya hai.","Ahh.. Hein? Indravardhan, vo refrigerator repair vaale ko phone karo na baba. Humara fridge kharab ho gaya hai. Aur mera dimmakh bhe.",ah hein indravardhan vu refrigeratur repair vale ku phune karu na baba humara fridg kharab hu gaya hai aur mera dimakh bhe
220,hush hush hush hush rosesh ye kya kar rha hai tu dad mei lehra raha hun naye natak mei hawa ka role kar raha hun kaise ulte seedhe role karta hai tu pichle natak mei kya bana tha jismei apni peet par rengte rengte dialogue bol rha tha dusro ki silverte todte todte tut chuki hun mein,2,kaise ulte seedhe role karta hai tu pichle natak mei kya bana tha jismei apni peet par rengte rengte dialogue bol rha tha dusro ki silverte todte todte tut chuki hun mein,hush hush hush hush rosesh ye kya kar rha hai tu dad mei lehra raha hun naye natak mei hawa ka role kar raha hun,hush hush hush hush rosesh ye kya kar rha hai tu dad mei lehra raha hun naye natak mei hawa ka role kar raha hun kaise ulte seedhe role karta hai tu pichle natak mei kya bana tha jismei apni peet par rengte rengte dialogue bol rha tha dusro ki silverte todte todte tut chuki hun mein,hush hush hush hush rusesh ye kya kar rha hai tu dad mei lehra raha hun nay natak mei hava ka rule kar raha hun kais ult sedh rule karta hai tu pichl natak mei kya bana tha jismei apni pet par rengt rengt dialugu bul rha tha dusru ki silvert tudt tudt tut chuki hun mein
221,Sahil bhai Madhu Fufa Sun sakte hain are you crazy,2,are you crazy,Sahil bhai Madhu Fufa Sun sakte hain,Sahil bhai Madhu Fufa Sun sakte hain are you crazy,sahil bhai madhu fufa sun sakt hain yu craji
222,"Mujhe tere ghar mein rahane mein koi aitraaz nahi hai, lekin apana ghar aakhir apana ghar hota hai na! Upar se vo ghar to ghar bhi hai.",2,Upar se vo ghar to ghar bhi hai.,"Mujhe tere ghar mein rahane mein koi aitraaz nahi hai, lekin apana ghar aakhir apana ghar hota hai na!","Mujhe tere ghar mein rahane mein koi aitraaz nahi hai, lekin apana ghar aakhir apana ghar hota hai na! Upar se vo ghar to ghar bhi hai.",mujh tere ghar mein rahan mein kui aitraj nahi hai lekin apana ghar akhir apana ghar huta hai na upar se vu ghar tu ghar bhi hai
223,Sweetie... It's all right momma. I'll be fine. But what about us!,0,But what about us!,Sweetie... It's all right momma. I'll be fine.,Sweetie... It's all right momma. I'll be fine. But what about us!,sveti al right muma l fine vhat abut us
224,"Aap dekhna chaahati hai ki vo mujhase kitna pyaar karte hai? Definitely! Daddy, mujhe pyaas lagi hai, pani? Ofcourse, ah, beta sadha piyoge ya thanda? Mere munna! Unbelievable!",1,Unbelievable!,"Aap dekhna chaahati hai ki vo mujhase kitna pyaar karte hai? Definitely! Daddy, mujhe pyaas lagi hai, pani? Ofcourse, ah, beta sadha piyoge ya thanda? Mere munna!","Aap dekhna chaahati hai ki vo mujhase kitna pyaar karte hai? Definitely! Daddy, mujhe pyaas lagi hai, pani? Ofcourse, ah, beta sadha piyoge ya thanda? Mere munna! Unbelievable!",aap dekhna chahati hai ki vu mujhas kitna pyar kart hai definit dadi mujh pya lagi hai pani ofcurs ah beta sadha piyug ya thanda mere muna unbeliev
225,sahil sahil meine service charge ke 300 rupaye bacha liye heheh congratulations. toh champagne khole ya jaljeera se kaam chalega,2,congratulations. toh champagne khole ya jaljeera se kaam chalega,sahil sahil meine service charge ke 300 rupaye bacha liye heheh,sahil sahil meine service charge ke 300 rupaye bacha liye heheh congratulations. toh champagne khole ya jaljeera se kaam chalega,sahil sahil mein servic charg ke 30 rupay bacha liy heheh cungratulatiun tuh champagn khule ya jaljera se kam chalega
226,"Rosesh darling, ye repair ho sakega? No Momma. Mai ise theek kara dungi! Apne ghar ke mechanic se, Jijaji! Dushyant! Dushyant! Hello, Jjaji! Nahi nahi! Use phone ke bare mein mat batana! Wrong number Jijaji! Kya hua mummy ji. Aap ne mujhe daraa hi diya. Aur tumne jo hume dara diya, uska kya!",1,"Aur tumne jo hume dara diya, uska kya!","Rosesh darling, ye repair ho sakega? No Momma. Mai ise theek kara dungi! Apne ghar ke mechanic se, Jijaji! Dushyant! Dushyant! Hello, Jjaji! Nahi nahi! Use phone ke bare mein mat batana! Wrong number Jijaji! Kya hua mummy ji. Aap ne mujhe daraa hi diya.","Rosesh darling, ye repair ho sakega? No Momma. Mai ise theek kara dungi! Apne ghar ke mechanic se, Jijaji! Dushyant! Dushyant! Hello, Jjaji! Nahi nahi! Use phone ke bare mein mat batana! Wrong number Jijaji! Kya hua mummy ji. Aap ne mujhe daraa hi diya. Aur tumne jo hume dara diya, uska kya!",rusesh darl ye repair hu sakega nu muma mai ise thek kara dungi apn ghar ke mechan se jijaji dushyant dushyant helu jjaji nahi nahi use phune ke bare mein mat batana wrung number jijaji kya hua mumi ji aap ne mujh dara hi diya aur tumn ju hume dara diya uska kya
227,"It's okay. I am so glad that you are back. Ab kaisa lag raha hai tumhe? bohot achchha lag raha hai. Balki bohot badiya lag raha hai. Haan, ye thodasa tight hai, lekin 4th floor pe vo Bhatia rehata hai na, vo kehe raha tha ki, ""Baby, tighter the better!""",2,"Haan, ye thodasa tight hai, lekin 4th floor pe vo Bhatia rehata hai na, vo kehe raha tha ki, ""Baby, tighter the better!""",It's okay. I am so glad that you are back. Ab kaisa lag raha hai tumhe? bohot achchha lag raha hai. Balki bohot badiya lag raha hai.,"It's okay. I am so glad that you are back. Ab kaisa lag raha hai tumhe? bohot achchha lag raha hai. Balki bohot badiya lag raha hai. Haan, ye thodasa tight hai, lekin 4th floor pe vo Bhatia rehata hai na, vo kehe raha tha ki, ""Baby, tighter the better!""",ukay su glad yu back ab kaisa lag raha hai tumh buhut achcha lag raha hai balki buhut badiya lag raha hai han ye thudasa tight hai lekin 4th flur pe vu bhatia rehata hai na vu kehe raha tha ki babi tighter beter
228,Indravadan yaad Hai Ek Din Hamare ghar per bijali Chali gai aur Tumhari Ba Ne Mujh Par ilzaam Lagaya Tha Are han han yad hai are bakuda ye maya dekh jor jor se gala daba rahi hai mera haha Bechari pagali thi kuchh Bhi bol deti hai,2,Are han han yad hai are bakuda ye maya dekh jor jor se gala daba rahi hai mera haha Bechari pagali thi kuchh Bhi bol deti hai,Indravadan yaad Hai Ek Din Hamare ghar per bijali Chali gai aur Tumhari Ba Ne Mujh Par ilzaam Lagaya Tha,Indravadan yaad Hai Ek Din Hamare ghar per bijali Chali gai aur Tumhari Ba Ne Mujh Par ilzaam Lagaya Tha Are han han yad hai are bakuda ye maya dekh jor jor se gala daba rahi hai mera haha Bechari pagali thi kuchh Bhi bol deti hai,indravadan yad hai ek din hamar ghar per bijali chali gai aur tumhari ba ne mujh par iljam lagaya tha han han yad hai bakuda ye maya dekh jur jur se gala daba rahi hai mera haha bechari pagali thi kuch bhi bul deti hai
229,"Khaari biscuit! Aray waah! What do you mean 'Aray waah!'. Ye nahi khaao. Kyu? Vo jo biscuit vaala bhaiya, aluminium ki trunk mein se nikalata hai biscuit, usaki lungi dekhi hai kabhi tumane?",1,"Vo jo biscuit vaala bhaiya, aluminium ki trunk mein se nikalata hai biscuit, usaki lungi dekhi hai kabhi tumane?",Khaari biscuit! Aray waah! What do you mean 'Aray waah!'. Ye nahi khaao. Kyu?,"Khaari biscuit! Aray waah! What do you mean 'Aray waah!'. Ye nahi khaao. Kyu? Vo jo biscuit vaala bhaiya, aluminium ki trunk mein se nikalata hai biscuit, usaki lungi dekhi hai kabhi tumane?",khari biscuit aray vah du yu mean aray vah ye nahi khau kyu vu ju biscuit vala bhaiya aluminium ki trunk mein se nikalata hai biscuit usaki lungi dekhi hai kabhi tuman
230, rosesh Baba Ne 5 Saal Ki Umar Mein hi Kavita likhna Shuru kar diya tha vah apni Har Kavita sabse pahle Mujhe Suna the fir bhi main Kabhi Koi Shikayat ki?,3,rosesh Baba Ne 5 Saal Ki Umar Mein hi Kavita likhna Shuru kar diya tha vah apni Har Kavita sabse pahle Mujhe Suna the fir bhi main Kabhi Koi Shikayat ki?,, rosesh Baba Ne 5 Saal Ki Umar Mein hi Kavita likhna Shuru kar diya tha vah apni Har Kavita sabse pahle Mujhe Suna the fir bhi main Kabhi Koi Shikayat ki?,rusesh baba ne 5 sal ki umar mein hi kavita likhna shuru kar diya tha vah apni har kavita sabs pahl mujh suna fir bhi main kabhi kui shikayat ki
231,"Thank God tum aa gaye Siddharth, ye kya kiya tumne! You know Indravardhan saadi pehen kar ke ghoom raha hai! Maine,maine dekha. Mujhe dekha kar usane kaha, 'Hi Siddharth!' Kaha!? Neeche, lobby mein. Lobby mein kya kar raha hai vo! Aray tumhaari koi padosan hai, usse strawberry barfi ki recipe le rahi hai Indravardhan.",2,"Aray tumhaari koi padosan hai, usse strawberry barfi ki recipe le rahi hai Indravardhan.","Thank God tum aa gaye Siddharth, ye kya kiya tumne! You know Indravardhan saadi pehen kar ke ghoom raha hai! Maine,maine dekha. Mujhe dekha kar usane kaha, 'Hi Siddharth!' Kaha!? Neeche, lobby mein. Lobby mein kya kar raha hai vo!","Thank God tum aa gaye Siddharth, ye kya kiya tumne! You know Indravardhan saadi pehen kar ke ghoom raha hai! Maine,maine dekha. Mujhe dekha kar usane kaha, 'Hi Siddharth!' Kaha!? Neeche, lobby mein. Lobby mein kya kar raha hai vo! Aray tumhaari koi padosan hai, usse strawberry barfi ki recipe le rahi hai Indravardhan.",thank gud tum gay sidharth ye kya kiya tumn yu knuv indravardhan sadi pehen kar ke ghum raha hai main main dekha mujh dekha kar usan kaha hi sidharth kaha nech lubi mein lubi mein kya kar raha hai vu aray tumhari kui padusan hai use stravberi barfi ki recip le rahi hai indravardhan
232,Now darling. Tum Shayad Koi Sapna Dekha hoga Nahin Maya. Monisha khushbudar khana Lekar enter Hui aur. There what did I tell you? Tumne Sapna hi Dekha Hai. Monisha ka khushboodar khana Lekar Aana sach mein possible hai?,0,There what did I tell you? Tumne Sapna hi Dekha Hai. Monisha ka khushboodar khana Lekar Aana sach mein possible hai?,Now darling. Tum Shayad Koi Sapna Dekha hoga Nahin Maya. Monisha khushbudar khana Lekar enter Hui aur.,Now darling. Tum Shayad Koi Sapna Dekha hoga Nahin Maya. Monisha khushbudar khana Lekar enter Hui aur. There what did I tell you? Tumne Sapna hi Dekha Hai. Monisha ka khushboodar khana Lekar Aana sach mein possible hai?,nuv darl tum shayad kui sapna dekha huga nahin maya munisha khushbudar khana lekar enter hui aur vhat tel yu tumn sapna hi dekha hai munisha ka khushbudar khana lekar aana sach mein pusibl hai
233,"Come on Maya, calm down... I just can't calm down! Aray dekho Radhabai ne amritsari daal aur... Aah! Sabzi mein methi chaman banai hai! Chalo chalo aao baitho! Mujhe nahi baithana kahi bhi! To mujhe parosega kaun? Ahahaha! Bulaao na! Apni laadli bahu ko! Parosane mein to expert ho gayi hai na aajkal! I just can't believe what she has done!",0,Ahahaha! Bulaao na! Apni laadli bahu ko! Parosane mein to expert ho gayi hai na aajkal! I just can't believe what she has done!,"Come on Maya, calm down... I just can't calm down! Aray dekho Radhabai ne amritsari daal aur... Aah! Sabzi mein methi chaman banai hai! Chalo chalo aao baitho! Mujhe nahi baithana kahi bhi! To mujhe parosega kaun?","Come on Maya, calm down... I just can't calm down! Aray dekho Radhabai ne amritsari daal aur... Aah! Sabzi mein methi chaman banai hai! Chalo chalo aao baitho! Mujhe nahi baithana kahi bhi! To mujhe parosega kaun? Ahahaha! Bulaao na! Apni laadli bahu ko! Parosane mein to expert ho gayi hai na aajkal! I just can't believe what she has done!",cume un maya calm duvn calm duvn aray dekhu radhabai ne amritsari dal aur aah sabji mein methi chaman banai hai chalu chalu au baithu mujh nahi baithana kahi bhi tu mujh parusega kaun ahahaha bulau na apni ladli bahu ku parusan mein tu expert hu gayi hai na ajkal believ vhat dune
234,"Thik hain lekin kam se kam kissi paintain ki dukaan mein jaake exchamge to kar sakte hain Exchange ? Haan hum dukkandar se kahenge ki aise hi paintaing kissi aur color mein hain kya? Picasso ki paintain hain Monisha. Chappal nahi hain ki teen color mein bikegi Dekho bete, wo jo Picasso ki paintain hain na, wo humaare MF Hussain ne banayi hain",0,"Dekho bete, wo jo Picasso ki paintain hain na, wo humaare MF Hussain ne banayi hain",Thik hain lekin kam se kam kissi paintain ki dukaan mein jaake exchamge to kar sakte hain Exchange ? Haan hum dukkandar se kahenge ki aise hi paintaing kissi aur color mein hain kya? Picasso ki paintain hain Monisha. Chappal nahi hain ki teen color mein bikegi,"Thik hain lekin kam se kam kissi paintain ki dukaan mein jaake exchamge to kar sakte hain Exchange ? Haan hum dukkandar se kahenge ki aise hi paintaing kissi aur color mein hain kya? Picasso ki paintain hain Monisha. Chappal nahi hain ki teen color mein bikegi Dekho bete, wo jo Picasso ki paintain hain na, wo humaare MF Hussain ne banayi hain",thik hain lekin kam se kam kisi paintain ki dukan mein jake exchamg tu kar sakt hain exchang han hum dukandar se kaheng ki ais hi painta kisi aur culur mein hain kya picasu ki paintain hain munisha chapal nahi hain ki ten culur mein bikegi dekhu bete vu ju picasu ki paintain hain na vu humar mf husain ne banayi hain
235,"Oye chup oye! Chup! Yye ki wadda tv! Chintu, Mintu, Happy, Lucky, Baggu.. Pehle beeji ke pair to chuo kamino! Chalo! Pairi padna Beeji! Achchha, achchha, bas, bas... it's okay. God bless you all... And me!",1,"Achchha, achchha, bas, bas... it's okay. God bless you all... And me!","Oye chup oye! Chup! Yye ki wadda tv! Chintu, Mintu, Happy, Lucky, Baggu.. Pehle beeji ke pair to chuo kamino! Chalo! Pairi padna Beeji!","Oye chup oye! Chup! Yye ki wadda tv! Chintu, Mintu, Happy, Lucky, Baggu.. Pehle beeji ke pair to chuo kamino! Chalo! Pairi padna Beeji! Achchha, achchha, bas, bas... it's okay. God bless you all... And me!",oye chup uye chup yye ki vada tv chintu mintu hapi lucki bagu pehl beji ke pair tu chu kaminu chalu pairi padna beji achcha achcha ba ba ukay gud ble yu al
236,"everybody, pay attention. Sahil bhai, monisha bhabhi, beth jaiye. Dad, shanti diwas pe aap ye wala natak perform kijiega. natak ka naam kya hai naam hai- ‘shah jahan agar taj mahal banwane ka plan last minute pe cancel karke uski jagah seedhi saadhi south indian hotel banwate to’ ye naam hai ek min ek min. Shah jahan taj mahal banwane ke badle ek seedhi saadhi south indian hotel kyun banwega kyunki wo sasta padta na daddy ji",1,kyunki wo sasta padta na daddy ji,"everybody, pay attention. Sahil bhai, monisha bhabhi, beth jaiye. Dad, shanti diwas pe aap ye wala natak perform kijiega. natak ka naam kya hai naam hai- ‘shah jahan agar taj mahal banwane ka plan last minute pe cancel karke uski jagah seedhi saadhi south indian hotel banwate to’ ye naam hai ek min ek min. Shah jahan taj mahal banwane ke badle ek seedhi saadhi south indian hotel kyun banwega","everybody, pay attention. Sahil bhai, monisha bhabhi, beth jaiye. Dad, shanti diwas pe aap ye wala natak perform kijiega. natak ka naam kya hai naam hai- ‘shah jahan agar taj mahal banwane ka plan last minute pe cancel karke uski jagah seedhi saadhi south indian hotel banwate to’ ye naam hai ek min ek min. Shah jahan taj mahal banwane ke badle ek seedhi saadhi south indian hotel kyun banwega kyunki wo sasta padta na daddy ji",everybudi pay atentiun sahil bhai munisha bhabhi beth jaiy dad shanti diva pe ap ye vala natak perfurm kijiega natak ka nam kya hai nam hai shah jahan agar taj mahal banvan ka plan last minut pe cancel kark uski jagah sedhi sadhi suth indian hutel banvat tu ye nam hai ek min ek min shah jahan taj mahal banvan ke badl ek sedhi sadhi suth indian hutel kyun banvega kyunki vu sasta padta na dadi ji
